user_input,retrieved_contexts,response,reference,context_precision,faithfulness,answer_relevancy,context_recall,retrieval
¿Qué se entiende por cerveza?,"['CAPÍTULO XIII\nBEBIDAS FERMENTADAS\nCERVEZAS\nArtículo 1080 - (Resolución Conjunta SPRyRS N° 63/02 y SAGPyA N° 345/02)\n1. DESCRIPCIÓN\n1.1 DEFINICIONES\n1.1.1 Cerveza\nSe entiende exclusivamente por cerveza la bebida resultante de fermentar, mediante\nlevadura cervecera, al mosto de cebada malteada o de extracto de malta, sometido\npreviamente a un proceso de cocción, adicionado de lúpulo. Una parte de la cebada\nmalteada o de extracto de malta podrá ser reemplazada por adjuntos cerveceros.\nLa cerveza negra podrá ser azucarada.\nLa cerveza podrá ser adicionada de colorantes, saborizantes y aromatizantes.\n1.1.2 Malta Líquida\nSe entiende por malta líquida la bebida no alcohólica, resultante del mosto de cebada', '1.2.4.1 Cerveza\nEs la cerveza elaborada a partir de un mosto cuyo extracto primitivo contiene un\nmínimo de 55% en peso de cebada malteada.\n1.2.4.2 Cerveza 100% malta o de pura malta\nEs la cerveza elaborada a partir de un mosto cuyo extracto primitivo proviene\nexclusivamente de cebada malteada.\n1.2.4.3 Cerveza de ... (seguida del nombre del o de los cereales mayoritarios).\nEs la cerveza elaborada a partir de un mosto cuyo extracto primitivo proviene\nmayoritariamente de adjuntos cerveceros. Podrá tener hasta un 80% en peso de la\ntotalidad de los adjuntos cerveceros referido a su extracto primitivo (no menos del\n20% en peso de malta). Cuando dos o más cereales aporten igual cantidad de extracto\nprimitivo deben citarse todos ellos.', 'igual a 14,0% en peso.\n1.2.1.4 Cerveza Fuerte\nEs la cerveza cuyo extracto primitivo es mayor a 14.0% en peso.\n1.2.2 Respecto al grado alcohólico\n1.2.2.1 Cerveza sin alcohol\nSe entiende por cerveza sin alcohol a la cerveza cuyo contenido alcohólico es inferior o\nigual a 0,5% en volumen (0,5% vol.).\n1.2.2.2 Cerveza con alcohol o Cerveza\nEs la cerveza cuyo contenido alcohólico es superior a 0,5% en volumen (0,5% vol.)\n1.2.3 Respecto al color\n1.2.3.1 Cerveza clara, blanca, rubia o Cerveza\nEs la cerveza cuyo color es inferior a 20 unidades E.B.C. (European Brewery\nConvention).\n1.2.3.2 Cerveza oscura o Cerveza negra\nEs la cerveza cuyo color es igual o superior a 20 unidades E.B.C. (European Brewery\nConvention).\n1.2.4 Respecto a la proporción de materias primas.', '1.3 Designación (denominación de venta)\n1.3.1. Cerveza\nSe designa con el nombre de cerveza a la bebida definida en el numeral 1.1.1. y que\ncumple con las características establecidas en los numerales 1.2.1.2., 1.2.2.2., 1.2.3.1\ny 1.2.4.1.\n1.3.2. Cerveza liviana y Cerveza Light.\nSe designa con el nombre de cerveza light a la cerveza que cumple con las\ncaracterísticas establecidas en el numeral 1.2.1.1.\n1.3.3. Cerveza extra\nPara designar una cerveza como cerveza extra la misma deberá cumplir con las\ncaracterísticas establecidas en el numeral 1.2.1.3.\n1.3.4. Cerveza fuerte.\nPara designar una cerveza como cerveza fuerte, la misma deberá cumplir con las\ncaracterísticas establecidas en el numeral 1.2.1.4.\n1.3.5. Cerveza sin alcohol.', 'Es la cerveza cuyo extracto primitivo es mayor o igual al 5% en peso y menor que\n10,5% en peso.\nPodrá denominarse ""light"", a la cerveza liviana cuando también cumpla con los\nrequisitos a) y b)\na. Reducción de 25% del contenido de nutrientes y/o del valor energético con relación\na una cerveza similar del mismo fabricante (misma marca) o del valor medio del\ncontenido de tres cervezas similares conocidas, que sean producidas en la región.\nb. Valor energético de la cerveza lista para el consumo: máximo de 35Kcal/100 ml.\n1.2.1.2 Cerveza\nEs la cerveza cuyo extracto primitivo es mayor o igual a 10,5% en peso, y es menor de\n12,0% en peso.\n1.2.1.3. Cerveza Extra\nEs la cerveza cuyo extracto primitivo es mayor o igual a 12,0% en peso y menor o', 'Se designa con el nombre de cerveza sin alcohol, a la cerveza que cumple con las\ncaracterísticas establecidas en el numeral 1.2.2.1.\n1.3.6. Cerveza oscura o Cerveza negra.\nSe designa con el nombre de cerveza oscura o cerveza negra a la cerveza que cumple\ncon las características establecidas en el numeral 1.2.3.2.\n1.3.7. Cerveza 100% malta o de pura malta.\nSe podrá designar con el nombre de cerveza 100% malta o de pura malta a la cerveza\nque cumple con las características establecidas en el numeral 1.2.4.2.\n1.3.8. Cerveza de ... (seguido del nombre del adjunto cervecero mayoritario).\nSe designa con el nombre de cerveza de ... (seguido del nombre del adjunto\nmayoritario) a la cerveza que cumple con las características establecidas en el numeral\n1.2.4.3.', 'Artículo 1258 - Dec 61, 17.1.77\n""Con la denominación de Levadura de cerveza desamargada, se entiende el producto obtenido\npor procedimientos adecuados y desecación conveniente de las levaduras de cervecería,\nenvasada en un recipiente bromatológicamente apto.\nSe presentará en forma de gránulos o comprimidos; de color grisáceo; con olor y sabor\npropios, sin olores ni sabores extraños.\nPara la elaboración de los gránulos o comprimidos podrá utilizarse hasta el 15,0% de: harina,\nféculas, almidón, azúcar blanco o común, dextrosa, azúcar invertido, jarabe de glucosa o sus\nmezclas.\nEste producto se rotulará: Levadura de cerveza desamargada, formando una o dos frases con\ncaracteres de igual tamaño, realce y visibilidad.', 'ASBC: Americán Society of Brewing Chemists ACBC ASBC: American Society of\nBrewing Chemists.\nEBC: European Brewery Convention.\n3. COMPOSICIÓN Y CARACTERÍSTICAS\n3.1. Composición\n1.1 Ingredientes obligatorios de la cerveza\n3.1.1.1 Agua\nEl agua empleada en la elaboración de cerveza debe ser apta para el consumo\nhumano.\n3.1.1.2 Cebada malteada\nSegún definición del numeral 2.1.3\n3.1.1.3 Lúpulo\nSon los conos de la inflorescencia del Humulus lupulus, bajo su forma natural o\nindustrializada, aptos para el consumo humano.\n3.1.1.4 Levadura de cerveza\nSon microorganismos cuya función es fermentar el mosto.\n3.1.2 Ingredientes opcionales de la cerveza\n3.1.2.1 Extracto de malta\nSegún definición del numeral 1.1.4.\n3.1.2.2. Adjuntos cerveceros', 'Las Fábricas de cervezas, también llamadas cervecerías, además de responder a las normas de\ncarácter general, deben satisfacer las siguientes:\n1. Los recipientes, cubas de braceado y cocción, cubas de fermentación, envases, etc,\ndeben ser construidos o revestidos de materiales inalterables a la acción directa del producto.\n2. Las cámaras o sótanos donde se realice la fermentación estarán aislados del medio\nexterior y serán provistos de instalaciones de ventilación y refrigeración.\nSus pisos y paredes serán de material impermeable.\nLos locales en que se realice la fermentación principal poseerán dispositivos de filtración de\naire, u otros que los reemplacen.\nArtículo 125', 'cereales, la cantidad máxima de azúcar empleada en relación a su extracto primitivo\ndeberá ser:\na. cerveza clara, menor o igual al 10% en peso\nb. cerveza oscura, menor o igual al 25% en peso\n1.1.6 Mosto\nEs la solución en agua potable de carbohidratos, proteínas, sales minerales y demás\ncompuestos resultantes de la degradación enzimática de la malta, con o sin adjuntos\ncerveceros, realizada mediante procesos tecnológicos adecuados.\n1.1.7 Extracto primitivo u original\nEs la cantidad de sustancias disueltas (extracto) del mosto que dio origen a la cerveza\ny se expresa en porcentaje (%) en peso.\n1.2 Clasificación de Cervezas\n1.2.1 Respecto al extracto primitivo\n1.2.1.1 Cerveza liviana']","Se entiende por cerveza exclusivamente la bebida resultante de fermentar, mediante levadura cervecera, al mosto de cebada malteada o de extracto de malta, sometido previamente a un proceso de cocción, adicionado de lúpulo. Una parte de la cebada malteada o de extracto de malta podrá ser reemplazada por adjuntos cerveceros. La cerveza podrá ser azucarada y adicionada de colorantes, saborizantes y aromatizantes.","Se entiende exclusivamente por cerveza la bebida resultante de fermentar, mediante
levadura cervecera, al mosto de cebada malteada o de extracto de malta, sometido
previamente a un proceso de cocción, adicionado de lúpulo. Una parte de la cebada
malteada o de extracto de malta podrá ser reemplazada por adjuntos cerveceros.
La cerveza negra podrá ser azucarada.
La cerveza podrá ser adicionada de colorantes, saborizantes y aromatizantes.",0.9214285714154082,1.0,0.8886169075909524,1.0,Basic
¿Qué se entiende por cerveza?,"['La cerveza se entiende exclusivamente como la bebida resultante de fermentar, mediante levadura cervecera, al mosto de cebada malteada o de extracto de malta, sometido previamente a un proceso de cocción, adicionado de lúpulo. Puede ser azucarada y adicionada de colorantes, saborizantes y aromatizantes.', 'Es importante destacar que la cerveza se entiende como una bebida alcohólica elaborada a partir de un mosto, siendo la cebada malteada un ingrediente fundamental en su producción. La cerveza puede clasificarse en diferentes tipos según la composición de su extracto primitivo, como la cerveza 100% malta o de pura malta, que se elabora exclusivamente con cebada malteada, o la cerveza de otros cereales en la que se permite el uso de adjuntos cerveceros, siempre y cuando la malta represente al menos el 20% en peso del extracto primitivo.', 'Se entiende por cerveza a la bebida definida en el numeral 1.1.1. y que cumple con las características establecidas en los numerales 1.2.1.2., 1.2.2.2., 1.2.3.1 y 1.2.4.1.', 'Es la cerveza cuyo extracto primitivo es mayor o igual al 5% en peso y menor que 10,5% en peso. Además, se menciona que una cerveza puede denominarse ""light"" si cumple con ciertos requisitos de reducción de contenido de nutrientes y valor energético.', 'La cerveza es un producto obtenido por procedimientos adecuados y desecación conveniente de las levaduras de cervecería, envasada en un recipiente bromatológicamente apto.', 'La definición de cerveza en el texto proporcionado es la siguiente: ""Con los nombres de Despacho de cerveza, Cervecería y Chopería, se entienden los comercios que en forma predominante se dedican a la venta al detalle de cervezas convenientemente enfriadas y gasificadas"".', 'Se entiende por cerveza como una bebida malteada o de extracto de malta y agua potable, sometida previamente a un proceso de cocción, que puede ser adicionada o no con lúpulo, coloreada o no con colorante caramelo, y carbonatada o no. Puede contener cebada malteada o extracto de malta, que es el grano de cebada cervecera sometido a germinación parcial y posterior deshidratación y/o tostado en condiciones tecnológicas adecuadas.', 'La cerveza coloreada es aquella a la que se le ha adicionado colorante aprobado en MERCOSUR para modificar las coloraciones propias naturales de la cerveza, exceptuando cuando se usa colorante caramelo para estandarizar la coloración natural propia de la cerveza.', 'La cerveza se entiende como una bebida que puede ser elaborada con extracto de jengibre y cerveza o cerveza liviana y carbonatada, siendo en este caso denominada como cerveza de jengibre o Ginger Beer.', 'La cerveza se define como una bebida que cumple con las características establecidas en la normativa correspondiente, pudiendo ser coloreada y con diferentes sabores, como por ejemplo cerveza de arroz liviana con limón coloreada.']","Según el contexto proporcionado, se entiende por cerveza exclusivamente como la bebida resultante de fermentar, mediante levadura cervecera, al mosto de cebada malteada o de extracto de malta, sometido previamente a un proceso de cocción, adicionado de lúpulo. La cerveza puede ser azucarada y adicionada de colorantes, saborizantes y aromatizantes. Además, se menciona que la cerveza puede ser elaborada con extracto de jengibre y ser carbonatada, en cuyo caso se denomina cerveza de jengibre o Ginger Beer.","Se entiende exclusivamente por cerveza la bebida resultante de fermentar, mediante
levadura cervecera, al mosto de cebada malteada o de extracto de malta, sometido
previamente a un proceso de cocción, adicionado de lúpulo. Una parte de la cebada
malteada o de extracto de malta podrá ser reemplazada por adjuntos cerveceros.
La cerveza negra podrá ser azucarada.
La cerveza podrá ser adicionada de colorantes, saborizantes y aromatizantes.",0.8928571428348213,0.9090909090909091,0.9567518324787967,0.75,Advanced
¿Cómo se clasifican las cervezas?,"['1.3 Designación (denominación de venta)\n1.3.1. Cerveza\nSe designa con el nombre de cerveza a la bebida definida en el numeral 1.1.1. y que\ncumple con las características establecidas en los numerales 1.2.1.2., 1.2.2.2., 1.2.3.1\ny 1.2.4.1.\n1.3.2. Cerveza liviana y Cerveza Light.\nSe designa con el nombre de cerveza light a la cerveza que cumple con las\ncaracterísticas establecidas en el numeral 1.2.1.1.\n1.3.3. Cerveza extra\nPara designar una cerveza como cerveza extra la misma deberá cumplir con las\ncaracterísticas establecidas en el numeral 1.2.1.3.\n1.3.4. Cerveza fuerte.\nPara designar una cerveza como cerveza fuerte, la misma deberá cumplir con las\ncaracterísticas establecidas en el numeral 1.2.1.4.\n1.3.5. Cerveza sin alcohol.', 'igual a 14,0% en peso.\n1.2.1.4 Cerveza Fuerte\nEs la cerveza cuyo extracto primitivo es mayor a 14.0% en peso.\n1.2.2 Respecto al grado alcohólico\n1.2.2.1 Cerveza sin alcohol\nSe entiende por cerveza sin alcohol a la cerveza cuyo contenido alcohólico es inferior o\nigual a 0,5% en volumen (0,5% vol.).\n1.2.2.2 Cerveza con alcohol o Cerveza\nEs la cerveza cuyo contenido alcohólico es superior a 0,5% en volumen (0,5% vol.)\n1.2.3 Respecto al color\n1.2.3.1 Cerveza clara, blanca, rubia o Cerveza\nEs la cerveza cuyo color es inferior a 20 unidades E.B.C. (European Brewery\nConvention).\n1.2.3.2 Cerveza oscura o Cerveza negra\nEs la cerveza cuyo color es igual o superior a 20 unidades E.B.C. (European Brewery\nConvention).\n1.2.4 Respecto a la proporción de materias primas.', 'típica de la cerveza definida en el numeral 1.2.3.1 no requerirá su declaración en el\nrótulo.\n8.2.3 Se podrá emplear en el rotulado, denominaciones de fantasía acompañando a las\ndenominaciones de venta descriptas en el numeral 1.3.\n8.2.4 La denominación de venta correspondiente a las diferentes clasificaciones de\ncervezas debe tener el mismo realce y tamaño de letra\n9 MÉTODOS DE ANÁLISIS\nLos métodos de análisis de rutina para la determinación de extracto primitivo, grado\nalcohólico y color que se utilizan son los de las normas ASBC y para análisis de\nreferencia se aplican los métodos analíticos EBC.\n10 MÉTODOS DE MUESTREO\nDe acuerdo a lo establecido en el presente Código""\nArtículo 1081 - (Resolución Conjunta RESFC-2018-16-APN-SRYGS#MSYDS\nNº16/2018)', 'ASBC: Americán Society of Brewing Chemists ACBC ASBC: American Society of\nBrewing Chemists.\nEBC: European Brewery Convention.\n3. COMPOSICIÓN Y CARACTERÍSTICAS\n3.1. Composición\n1.1 Ingredientes obligatorios de la cerveza\n3.1.1.1 Agua\nEl agua empleada en la elaboración de cerveza debe ser apta para el consumo\nhumano.\n3.1.1.2 Cebada malteada\nSegún definición del numeral 2.1.3\n3.1.1.3 Lúpulo\nSon los conos de la inflorescencia del Humulus lupulus, bajo su forma natural o\nindustrializada, aptos para el consumo humano.\n3.1.1.4 Levadura de cerveza\nSon microorganismos cuya función es fermentar el mosto.\n3.1.2 Ingredientes opcionales de la cerveza\n3.1.2.1 Extracto de malta\nSegún definición del numeral 1.1.4.\n3.1.2.2. Adjuntos cerveceros', '1.2.4.1 Cerveza\nEs la cerveza elaborada a partir de un mosto cuyo extracto primitivo contiene un\nmínimo de 55% en peso de cebada malteada.\n1.2.4.2 Cerveza 100% malta o de pura malta\nEs la cerveza elaborada a partir de un mosto cuyo extracto primitivo proviene\nexclusivamente de cebada malteada.\n1.2.4.3 Cerveza de ... (seguida del nombre del o de los cereales mayoritarios).\nEs la cerveza elaborada a partir de un mosto cuyo extracto primitivo proviene\nmayoritariamente de adjuntos cerveceros. Podrá tener hasta un 80% en peso de la\ntotalidad de los adjuntos cerveceros referido a su extracto primitivo (no menos del\n20% en peso de malta). Cuando dos o más cereales aporten igual cantidad de extracto\nprimitivo deben citarse todos ellos.']","Las cervezas se clasifican de la siguiente manera:

1. Cerveza: Es la bebida que cumple con las características establecidas en los numerales 1.2.1.2, 1.2.2.2, 1.2.3.1 y 1.2.4.1.
2. Cerveza liviana y Cerveza Light: Se designa como cerveza light a aquella que cumple con las características establecidas en el numeral 1.2.1.1.
3. Cerveza extra: Debe cumplir con las características establecidas en el numeral 1.2.1.3.
4. Cerveza fuerte: Se refiere a aquella cuyo extracto primitivo es mayor al 14.0% en peso.
5. Cerveza sin alcohol: Es aquella cuyo contenido alcohólico es igual o inferior al 0,5% en volumen.

Estas clasificaciones se basan en criterios como el contenido alcohólico, el color y la proporción de materias primas utilizadas en su elaboración.","El contenido de nutrientes y/o del valor energético con relación
a una cerveza similar del mismo fabricante (misma marca) o del valor medio del
contenido de tres cervezas similares conocidas, que sean producidas en la región.
b. Valor energético de la cerveza lista para el consumo: máximo de 35Kcal/100 ml.
1.2.1.2 Cerveza
Es la cerveza cuyo extracto primitivo es mayor o igual a 10,5% en peso, y es menor de
12,0% en peso.
1.2.1.3. Cerveza Extra
Es la cerveza cuyo extracto primitivo es mayor o igual a 12,0% en peso y menor o
igual a 14,0% en peso.
1.2.1.4 Cerveza Fuerte
Es la cerveza cuyo extracto primitivo es mayor a 14.0% en peso.
1.2.2 Respecto al grado alcohólico
1.2.2.1 Cerveza sin alcohol
Se entiende por cerveza sin alcohol a la cerveza cuyo contenido alcohólico es inferior o
igual a 0,5% en volumen (0,5% vol.).
1.2.2.2 Cerveza con alcohol o Cerveza
Es la cerveza cuyo contenido alcohólico es superior a 0,5% en volumen (0,5% vol.)
1.2.3 Respecto al color
1.2.3.1 Cerveza clara, blanca, rubia o Cerveza
Es la cerveza cuyo color es inferior a 20 unidades E.B.C. (European Brewery
Convention).
1.2.3.2 Cerveza oscura o Cerveza negra
Es la cerveza cuyo color es igual o superior a 20 unidades E.B.C. (European Brewery
Convention).
1.2.4 Respecto a la proporción de materias primas.
1.2.4.1 Cerveza
Es la cerveza elaborada a partir de un mosto cuyo extracto primitivo contiene un
mínimo de 55% en peso de cebada malteada.
1.2.4.2 Cerveza 100% malta o de pura malta
Es la cerveza elaborada a partir de un mosto cuyo extracto primitivo proviene
exclusivamente de cebada malteada.
1.2.4.3 Cerveza de ... (seguida del nombre del o de los cereales mayoritarios).
Es la cerveza elaborada a partir de un mosto cuyo extracto primitivo proviene
mayoritariamente de adjuntos cerveceros. Podrá tener hasta un 80% en peso de la
totalidad de los adjuntos cerveceros referido a su extracto primitivo (no menos del
20% en peso de malta). Cuando dos o más cereales aporten igual cantidad de extracto
primitivo deben citarse todos ellos.
1.2.5 Respecto a otros ingredientes
1.2.5.1 Cerveza coloreada
Es la cerveza a la que se le ha adicionado colorante/ s aprobado/s en MERCOSUR,
(exceptuando cuando se usa colorante caramelo para estandarizar la coloración,
natural propia de la cerveza) para modificar las coloraciones propias naturales de la
cerveza. Esta clasificación debe tener el mismo realce que las clasificaciones definidas
en los numerales 1.2.1, 1.2.2 y 1.2.4 Ejemplo: CERVEZA DE ARROZ LIVIANA
COLOREADA.
Las siguientes clasificaciones deben tener el mismo realce que las clasificaciones
definidas en los numerales 1.2.1, 1.2.2, 1.2.3, 1.2.4 y 1.2.5.1.
1.2.5.2 Cerveza con ... (seguido del nombre del vegetal) Es la cerveza a la que se le
ha adicionado jugo y/o extracto de origen vegetal (referido a la concentración de jugo)
hasta un máximo de 10% en volumen.
Ejemplo: cerveza de arroz LIVIANA con limón.
1.2.5.3. Cerveza sabor de ... (seguido del nombre del vegetal) o cerveza con aroma de
(seguido del nombre del vegetal).
Es la cerveza a la que se le ha adicionado aroma/ s aprobado/s en MERCOSUR.
Ejemplo: CERVEZA DE ARROZ LIVIANA CON AROMA DE LIMON.
1.2.5.4 Cerveza oscura o negra azucarada o Malzbier.
Es la cerveza oscura negra a la que se le ha adicionado azúcares de origen vegetal
hasta, un máximo de 50% con relación al extracto primitivo (incluyendo los azúcares
de origen vegetal empleados corno adjuntos cerveceros), para conferirle sabor dulce.",0.99999999998,0.8888888888888888,0.9104314333001838,0.8125,Basic
¿Cómo se clasifican las cervezas?,"['Las cervezas se clasifican en:\n- Cerveza\n- Cerveza light\n- Cerveza extra\n- Cerveza fuerte\n- Cerveza sin alcohol\n\nPor lo tanto, las cervezas se clasifican en diferentes categorías según cumplan con ciertas características establecidas en los numerales mencionados.', 'Las cervezas se clasifican según su contenido alcohólico en:\n- Cerveza sin alcohol: con un contenido alcohólico igual o inferior al 0,5% en volumen.\n- Cerveza con alcohol o Cerveza: con un contenido alcohólico superior al 0,5% en volumen.\nAdemás, se menciona la clasificación de las cervezas según su color, pero no se aborda la clasificación de las cervezas según su extracto primitivo.', 'Las cervezas se clasifican en tres categorías:\n1. Cerveza: elaborada a partir de un mosto con un mínimo de 55% en peso de cebada malteada.\n2. Cerveza 100% malta o de pura malta: elaborada exclusivamente con cebada malteada.\n3. Cerveza de ... (seguida del nombre del o de los cereales mayoritarios): elaborada mayoritariamente con adjuntos cerveceros, pudiendo tener hasta un 80% en peso de adjuntos cerveceros en su extracto primitivo, pero no menos del 20% en peso de malta.', 'Las cervezas se clasifican según la definición dada en el artículo 1080, donde se establece que la cerveza es la bebida resultante de fermentar, mediante levadura cervecera, al mosto de cebada malteada o de extracto de malta, sometido previamente a un proceso de cocción y adicionado de lúpulo. Además, se menciona que una parte de la cebada malteada o de extracto de malta puede ser reemplazada por adjuntos cerveceros, y que la cerveza puede ser azucarada, así como adicionada de colorantes, saborizantes y aromatizantes.', 'Las cervezas se clasifican según su extracto primitivo, pudiendo ser cerveza clara si tiene un máximo del 10% en peso de azúcar, o cerveza oscura si tiene un máximo del 25% en peso.']","Las cervezas se clasifican de diversas formas. Según el contexto proporcionado, se pueden clasificar de acuerdo a su contenido alcohólico en cerveza sin alcohol, con un contenido alcohólico igual o inferior al 0,5% en volumen, y cerveza con alcohol, con un contenido alcohólico superior al 0,5% en volumen. También se pueden clasificar según su contenido de extracto primitivo, siendo cerveza clara si tiene un máximo del 10% en peso de azúcar, o cerveza oscura si tiene un máximo del 25% en peso. Además, se menciona una clasificación basada en la composición de los ingredientes utilizados en su elaboración, dividiéndose en cerveza, cerveza 100% malta o de pura malta, y cerveza de otros cereales mayoritarios.","El contenido de nutrientes y/o del valor energético con relación
a una cerveza similar del mismo fabricante (misma marca) o del valor medio del
contenido de tres cervezas similares conocidas, que sean producidas en la región.
b. Valor energético de la cerveza lista para el consumo: máximo de 35Kcal/100 ml.
1.2.1.2 Cerveza
Es la cerveza cuyo extracto primitivo es mayor o igual a 10,5% en peso, y es menor de
12,0% en peso.
1.2.1.3. Cerveza Extra
Es la cerveza cuyo extracto primitivo es mayor o igual a 12,0% en peso y menor o
igual a 14,0% en peso.
1.2.1.4 Cerveza Fuerte
Es la cerveza cuyo extracto primitivo es mayor a 14.0% en peso.
1.2.2 Respecto al grado alcohólico
1.2.2.1 Cerveza sin alcohol
Se entiende por cerveza sin alcohol a la cerveza cuyo contenido alcohólico es inferior o
igual a 0,5% en volumen (0,5% vol.).
1.2.2.2 Cerveza con alcohol o Cerveza
Es la cerveza cuyo contenido alcohólico es superior a 0,5% en volumen (0,5% vol.)
1.2.3 Respecto al color
1.2.3.1 Cerveza clara, blanca, rubia o Cerveza
Es la cerveza cuyo color es inferior a 20 unidades E.B.C. (European Brewery
Convention).
1.2.3.2 Cerveza oscura o Cerveza negra
Es la cerveza cuyo color es igual o superior a 20 unidades E.B.C. (European Brewery
Convention).
1.2.4 Respecto a la proporción de materias primas.
1.2.4.1 Cerveza
Es la cerveza elaborada a partir de un mosto cuyo extracto primitivo contiene un
mínimo de 55% en peso de cebada malteada.
1.2.4.2 Cerveza 100% malta o de pura malta
Es la cerveza elaborada a partir de un mosto cuyo extracto primitivo proviene
exclusivamente de cebada malteada.
1.2.4.3 Cerveza de ... (seguida del nombre del o de los cereales mayoritarios).
Es la cerveza elaborada a partir de un mosto cuyo extracto primitivo proviene
mayoritariamente de adjuntos cerveceros. Podrá tener hasta un 80% en peso de la
totalidad de los adjuntos cerveceros referido a su extracto primitivo (no menos del
20% en peso de malta). Cuando dos o más cereales aporten igual cantidad de extracto
primitivo deben citarse todos ellos.
1.2.5 Respecto a otros ingredientes
1.2.5.1 Cerveza coloreada
Es la cerveza a la que se le ha adicionado colorante/ s aprobado/s en MERCOSUR,
(exceptuando cuando se usa colorante caramelo para estandarizar la coloración,
natural propia de la cerveza) para modificar las coloraciones propias naturales de la
cerveza. Esta clasificación debe tener el mismo realce que las clasificaciones definidas
en los numerales 1.2.1, 1.2.2 y 1.2.4 Ejemplo: CERVEZA DE ARROZ LIVIANA
COLOREADA.
Las siguientes clasificaciones deben tener el mismo realce que las clasificaciones
definidas en los numerales 1.2.1, 1.2.2, 1.2.3, 1.2.4 y 1.2.5.1.
1.2.5.2 Cerveza con ... (seguido del nombre del vegetal) Es la cerveza a la que se le
ha adicionado jugo y/o extracto de origen vegetal (referido a la concentración de jugo)
hasta un máximo de 10% en volumen.
Ejemplo: cerveza de arroz LIVIANA con limón.
1.2.5.3. Cerveza sabor de ... (seguido del nombre del vegetal) o cerveza con aroma de
(seguido del nombre del vegetal).
Es la cerveza a la que se le ha adicionado aroma/ s aprobado/s en MERCOSUR.
Ejemplo: CERVEZA DE ARROZ LIVIANA CON AROMA DE LIMON.
1.2.5.4 Cerveza oscura o negra azucarada o Malzbier.
Es la cerveza oscura negra a la que se le ha adicionado azúcares de origen vegetal
hasta, un máximo de 50% con relación al extracto primitivo (incluyendo los azúcares
de origen vegetal empleados corno adjuntos cerveceros), para conferirle sabor dulce.",0.8041666666465626,0.8888888888888888,1.0000000000000009,0.6875,Advanced
¿Qué se define como sidra?,"['“Se entiende por Sidra Analcohólica o Sidra sin Alcohol a la sidra a la cual se le ha\neliminado el alcohol mediante técnicas previamente autorizadas por la autoridad\ncompetente, con un contenido máximo de alcohol de 0,5% en Vol. a 20°C.""\nArtículo 1085 tetra - (Resolución Conjunta SPRyRS N° 87/04 y SAGPyA N°\n566/04)\n“Sidra Espumante: es la bebida obtenida a partir de sidra base, con una presión\nmínima de 3 atmósferas lograda por la toma de espuma mediante un proceso biológico\nendógeno para la formación del dióxido de carbono. La fuente hidrocarbonada para la\nsegunda fermentación deberá provenir del azúcar residual de la sidra base y/o el\nagregado de jugo concentrado de manzana. Su graduación alcohólica mínima será de\n6,0 % en Vol. ±0,3% a 20°C"".', 'Artículo 1085 - (Resolución Conjunta SPRyRS N° 87/04 y SAGPyA N° 566/04)\n“Sidra Base es la bebida que resulta exclusivamente de la fermentación alcohólica\nnormal del jugo recién obtenido de manzanas sanas y limpias, de uso industrial, con o\nsin la adición de hasta un 10% de jugo de peras obtenido en idénticas condiciones que\nel jugo de manzana y fermentado en forma conjunta o separada. Su graduación\nalcohólica mínima será de 4,5% en Vol. ±0,3 a 20°C.""\nArtículo 1085 bis – (Resolución Conjunta SPRyRS N° 87/04 y SAGPyA N°\n566/04)\n“Sidra es la sidra base, endulzada y gasificada. Su graduación alcohólica mínima será\nde 4,0% en Vol. ±0,3 a 20°C.\nArtículo 1085 tris - (Resolución Conjunta SPRyRS N° 87/04 y SAGPyA N°\n566/04)', 'mismo constar los porcentajes de sidra espumante y jugos y/o pulpas\ncorrespondientes además de cumplir con todas las otras exigencias generales de\nrotulación.""\nArtículo 1085 hexa – (Resolución Conjunta SPRyRS N° 87/04 y SAGPyA N°\n566/04)\n“Sidra Frutada es la bebida gasificada elaborada a base de como mínimo 80% de\nSidra, adicionada con jugo y/o pulpas (propias de las frutas que dan origen a la\ndenominación) de una o más frutas, que respondan al art. 1040 del presente Código.\nEste producto se rotulará ""Sidra Frutada"". Sólo se admitirán los aditivos de\ntransferencia. La denominación de este producto deberá figurar inmediatamente\ndebajo del nombre de fantasía con caracteres de un tamaño no inferior a la 1/4 parte', 'Artículo 1085 penta - (Resolución Conjunta SPRyRS N° 87/04 y SAGPyA N°\n566/04)\n“Sidra Espumante Frutada es la bebida elaborada a base de como mínimo 80% de\nSidra Espumante, adicionada con jugo y/o pulpas (propias de las frutas que dan origen\na la denominación) de una o más frutas, que respondan al art. 1040 del presente\nCódigo. Este producto se rotulará ""Sidra Espumante Frutada"". Sólo se admitirán los\naditivos de transferencia. La denominación de este producto deberá figurar\ninmediatamente debajo del nombre de fantasía con caracteres de un tamaño no\ninferior a la 1/4 parte del mismo, nunca menor a 2 mm y con buen realce y visibilidad.\nEl listado de ingredientes deberá figurar en un lugar bien visible del rótulo y en el', 'precedentemente, serán clasificadas como bebida artificial y no podrán llevar\ndenominación alguna que incluya la palabra sidra.""\nArtículo 1085 deca - (Resolución Conjunta SPRyRS N° 87/04 y SAGPyA N°\n566/04)\n“En los rótulos de las sidras, excepto las que tengan menos de 0.5% en Vol. a 20°C\ndeberán consignarse las siguientes leyendas: ""BEBER CON MODERACION"" -\n""PROHIBIDA SU VENTA A MENORES DE 18 AÑOS"".\nArtículo 1086 – (Resolución Conjunta SPRyRS N° 124/2007 y SAGPyA N°\n62/2007)\n“A los efectos establecidos en el presente, no podrán denominarse sidra: Las sidras\nobtenidas por utilización de residuos del prensado de frutas. Las que hayan sido\nadicionadas desustancias que, aún siendo naturales en las sidras modifiquen o alteren', 'Artículo 1091 - (Resolución Conjunta SPRyRS N° 87/04 y SAGPyA N° 566/04)\n“Se consideran como inaptas para el consumo:\n1- Las Sidras enfermas, francamente turbias, averiadas, de gusto o aroma\ndesagradables o en cualquier forma alteradas.\n2- Las que tengan una acidez volátil que exceda de 2,5 g/l expresada en ácido acético.\n3- Las que exceden los 200 mg/l de metanol.\n4- Aquellas a las cuales se les hubiera adicionado sustancias prohibidas por el Art.\n1088 de este capítulo.""\nVINOS Y PRODUCTOS AFINES\nArtículo 1092\nSe entiende por Uva para vinos, el fruto fresco, maduro, sano y limpio de la Vitis\nvinifera L en sus distintas variedades y que una vez cosechado no ha sufrido proceso\nde fermentación o deshidratación alguno, ni ningún otro que modifique sus', 'la relación entre sus componentes. Las sidras que contengan:\na) menos de 4% de alcohol en volumen a 20°C, con una tolerancia analítica de 0,3%.\nb) menos de 16 g por litro de extracto seco reducido, entendiendo por tal el que\nresulte de sustraerdel extracto total a 100°C, las cantidades de azúcares que excedan\nde 1 g por litro.\nc) menos de 1,8 g por litro de cenizas a 500- 550°C, sin tolerancia.\nd) prolina en cantidad superior a 22 mg por litro.\ne) menos de 3 g por litro o más de 10 g por litro de sorbitol con una tolerancia\nanalítica de ± 0,5. Las que presenten un valor de densidad isotópica (_13C‰) sobre\nel destilado alcohólico, inferior a -28.5 o superior a -25,0, sin tolerancia analítica. Las']","La sidra se define como la bebida obtenida a partir de la fermentación alcohólica normal del jugo recién obtenido de manzanas sanas y limpias, pudiendo incluir hasta un 10% de jugo de peras, fermentado en forma conjunta o separada. La graduación alcohólica mínima de la sidra base es de 4,5% en Vol. a 20°C. Además, la sidra puede ser endulzada y gasificada, con una graduación alcohólica mínima de 4,0% en Vol. a 20°C. También existen variedades como la Sidra Espumante, Sidra Frutada y Sidra Espumante Frutada, cada una con sus propias características y porcentajes de ingredientes específicos, pero todas derivadas de la sidra base.","SIDRAS
Artículo 1085 - (Resolución Conjunta SPRyRS N° 87/04 y SAGPyA N° 566/04)
“Sidra Base es la bebida que resulta exclusivamente de la fermentación alcohólica
normal del jugo recién obtenido de manzanas sanas y limpias, de uso industrial, con o
sin la adición de hasta un 10% de jugo de peras obtenido en idénticas condiciones que
el jugo de manzana y fermentado en forma conjunta o separada. Su graduación
alcohólica mínima será de 4,5% en Vol. ±0,3 a 20°C.""",0.9999999999857143,1.0,0.9440859133422922,0.5,Basic
¿Qué se define como sidra?,"['La sidra se define como ""Sidra Analcohólica o Sidra sin Alcohol"" cuando se le ha eliminado el alcohol mediante técnicas autorizadas, con un contenido máximo de alcohol de 0,5% en Vol. a 20°C.', 'La sidra se define como la sidra base, endulzada y gasificada, que resulta de la fermentación alcohólica del jugo recién obtenido de manzanas sanas y limpias, pudiendo contener hasta un 10% de jugo de peras obtenido en las mismas condiciones que el jugo de manzana. Su graduación alcohólica mínima debe ser de 4,0% en Vol. ±0,3 a 20°C.', 'La sidra se define como una bebida gasificada elaborada a base de como mínimo 80% de sidra, adicionada con jugo y/o pulpas de una o más frutas que respondan a ciertas normativas. Se rotula como ""Sidra Frutada"" y solo se admiten aditivos de transferencia.', 'La sidra espumante frutada se define como una bebida elaborada a base de al menos 80% de sidra espumante, a la que se le añade jugo y/o pulpas de una o más frutas que cumplan con el artículo 1040 del código mencionado. Este producto se etiqueta como ""Sidra Espumante Frutada"" y solo se permiten aditivos de transferencia.', 'La sidra se define como una bebida gasificada elaborada a base de un contenido de sidra inferior a 50% y superior a 10%, con el agregado de jugos y/o pulpas y/o macerados de frutas, con una graduación alcohólica mínima de 2% en Vol. a 20°C.', 'La sidra se define como una de las materias primas distintas al vino que se utilizan para obtener vinagres, según el fragmento proporcionado.', 'Se define como sidra a la bebida con graduación alcohólica de 36 % a 54 % Vol. a 20°C, obtenida por la adición a destilados alcohólicos simples o al alcohol etílico potable de origen agrícola, de extractos de sustancias vegetales aromatizantes como piña, catecú, anís, cortezas aromáticas, etc.']","Según el contexto proporcionado, la sidra se define de varias formas dependiendo de sus características específicas:

1. Sidra Analcohólica o Sidra sin Alcohol: Es aquella a la que se le ha eliminado el alcohol mediante técnicas autorizadas, con un contenido máximo de alcohol de 0,5% en Vol. a 20°C.

2. Sidra Base: Es la sidra resultante de la fermentación alcohólica del jugo recién obtenido de manzanas sanas y limpias, pudiendo contener hasta un 10% de jugo de peras obtenido en las mismas condiciones que el jugo de manzana. Su graduación alcohólica mínima debe ser de 4,0% en Vol. ±0,3 a 20°C.

3. Sidra Frutada: Es una bebida gasificada elaborada a base de como mínimo 80% de sidra, adicionada con jugo y/o pulpas de una o más frutas que respondan a ciertas normativas. Se rotula como ""Sidra Frutada"" y solo se admiten aditivos de transferencia.

4. Sidra Espumante Frutada: Es una bebida elaborada a base de al menos 80% de sidra espumante, a la que se le añade jugo y/o pulpas de una o más frutas que cumplan con ciertas normativas. Se etiqueta como ""Sidra Espumante Frutada"" y solo se permiten aditivos de transferencia.

5. Otras definiciones incluyen una sidra con un contenido de sidra inferior a 50% y superior a 10%, con el agregado de jugos y/o pulpas y/o macerados de frutas, con una graduación alcohólica mínima de 2% en Vol. a 20°C.

En resumen, la sidra puede ser analcohólica, base, frutada, espumante frutada, entre otras variantes, cada una con sus propias características y porcentajes de contenido de alcohol.","SIDRAS
Artículo 1085 - (Resolución Conjunta SPRyRS N° 87/04 y SAGPyA N° 566/04)
“Sidra Base es la bebida que resulta exclusivamente de la fermentación alcohólica
normal del jugo recién obtenido de manzanas sanas y limpias, de uso industrial, con o
sin la adición de hasta un 10% de jugo de peras obtenido en idénticas condiciones que
el jugo de manzana y fermentado en forma conjunta o separada. Su graduación
alcohólica mínima será de 4,5% en Vol. ±0,3 a 20°C.""",0.7961904761745524,1.0,0.9424985852075393,0.5,Advanced
¿Se pueden añadir aromas a los vinos?,"['- El empleo de clarificantes admitidos por el presente Código para alimentos y bebidas en\ngeneral, tales como: Tierra de infusorios, Bentonita, PVP, Tanino y Gelatina.\n- La aromatización con estragón (hojas desecadas de Arthemisia dracunculus L.), laurel y otras\nespecies vegetales, condimentos, esencias naturales y naturales reforzadas, esencias y\nextractos sápido aromatizantes sintéticos y oleorresinas autorizados por el presente Código,\nexclusivamente para los vinagres de vino y de fruta. La aromatización deberá declararse en el\nrotulado en forma bien visible y cuando proceda de aromas artificiales, con la indicación de\nAromatizado artificialmente.\n- El uso de levaduras seleccionadas de Saccharomyces ellipsoideus, la bacteria Acetobacter', 'N° 37/2007 y N° 73/2007.\nArtículo 1298\nCon la denominación genérica de Aditivos aromatizantes o Saborizantes, se entienden los\npreparados que contienen los principios sápido-aromáticos de una planta o parte de ella y las\nsustancias artificiales de uso permitido, capaces de actuar sobre los sentidos del gusto y olfato,\nreforzando el propio del alimento o comunicándoles un sabor y/o aroma determinados.\nArtículo 1299\nA los efectos de este Código se consideran aditivos aromatizantes-saborizantes:\n1. Las Esencias Naturales o Aceites Esenciales.\n2. Los Extractos.\n3. Los Bálsamos, Oleorresinas y Oleogomorresinas.\n4. Los Compuestos Aislados de Esencias Naturales o de Extractos.\n5. Los Compuestos Químicos Sápido-Aromáticos Sintéticos o Artificiales.', '3. La adición de hasta 250 mg por litro de ácido sórbico o su equivalente en sorbatos,\nen los vinos con azúcar fermentable la que se efectuará en bodega bajo control técnico\nautorizado.\n4. Otras prácticas enológicas admitidas por el Instituto Nacional de Vitivinicultura que\ncumplan debidos recaudos en materia higiénicosanitaria y hayan sido previamente\naprobadas por la autoridad sanitaria nacional cuando comprendan el agregado de\naditivos.\nArtículo 1104\nQueda prohibida la circulación de vinos:\n1. Adicionados de agua en cualquier momento de su elaboración o con substancias que\naún siendo normales en los vinos, alteren su composición o desequilibren la relación de\nsus componentes.', 'AROMATIZANTE AROMATIZANTE\nSólo para aquellos vinagres adicionados con especias u otras especies vegetales, esencias\ny extractos aromatizantes\nSomente para vinagres adicionados de especiarias ou outras espécies vegetais, essências\ne extratos aromatizantes\nTodos los autorizados en MERCOSUR /Todos os autorizados no quantum satis\nMERCOSUL\nCOLORANTE CORANTE\n150 a Caramelo I- Simple (con Caramelo I- simples (exceto quantum satis\nexcepción de los vinagres de para vinagres de vinho)\nvino)\n150 b Caramelo II- Proceso Sulfito Caramelo II- processo sulfito quantum satis\nCáustico (con excepción de caústico (exceto para vinagres\nlos vinagres de vino) de vinho)\n150 c Caramelo III- Proceso Caramelo III- processo quantum satis']","Sí, se pueden añadir aromas a los vinos. Según el contexto proporcionado, la aromatización con especias, especies vegetales, condimentos, esencias naturales, esencias y extractos sápido aromatizantes sintéticos y oleorresinas está permitida exclusivamente para los vinagres de vino y de fruta. Es importante destacar que la aromatización debe ser declarada de forma visible en el etiquetado, y en caso de que se utilicen aromas artificiales, se debe indicar ""Aromatizado artificialmente"".","Artículo 1105
Queda prohibido fabricar, exponer, expender y anunciar productos o mezclas
destinados a mejorar o dar aroma a los vinos o mostos, así como colorantes,
edulcorantes o conservadores prohibidos, o cualquiera otra substancia que tenga por
objeto engañar al consumidor sobre sus cualidades esenciales, origen o clase o con el
fin de falsear los resultados analíticos o disimular una alteración.",0.4166666666458333,0.75,0.9549032515269497,1.0,Basic
¿Se pueden añadir aromas a los vinos?,"['Sí, se pueden añadir aromas a los vinos, pero en el caso específico del chunk proporcionado, se menciona que la aromatización con estragón, laurel y otras especies vegetales, condimentos, esencias naturales y naturales reforzadas, esencias y extractos sápido aromatizantes sintéticos y oleorresinas está autorizada exclusivamente para los vinagres de vino y de fruta. Además, se indica que la aromatización debe ser declarada en el rotulado de forma visible, y en caso de aromas artificiales, se debe indicar ""Aromatizado artificialmente"".', 'Sí, se pueden añadir aromas a los vinos utilizando aditivos aromatizantes o saborizantes. Estos aditivos pueden ser esencias naturales, aceites esenciales, extractos, bálsamos, oleorresinas, oleogomorresinas, compuestos aislados de esencias naturales o extractos, y compuestos químicos sápido-aromáticos sintéticos o artificiales, siempre y cuando estén permitidos por la normativa.', 'Sí, se pueden añadir aromas a los vinos mediante la adición de ácidos tártrico, cítrico, málico, tánico, así como también a través de la sulfitación, el carbónico tartrato neutro de potasio, el uso del calor o del frío para asegurar su conservación, el empleo de levaduras seleccionadas, la mezcla de dos o más vinos provenientes de distintas elaboraciones o cosechas, la alcoholización con alcohol vínico limitada para asegurar la conservación o la preparación de vinos especiales, y el uso de clarificantes autorizados.', 'Sí, se pueden añadir aromas a los vinos. Según el fragmento proporcionado, se menciona que los vinos pueden ser aromatizados con sustancias como vainillina, etilvainillina, canela, entre otros. En estos casos, es necesario consignar en el rótulo la leyenda correspondiente con el nombre de la sustancia empleada.']","Sí, se pueden añadir aromas a los vinos, pero según la información proporcionada, la aromatización con sustancias como estragón, laurel y otras especies vegetales, condimentos, esencias naturales y naturales reforzadas, esencias y extractos sápido aromatizantes sintéticos y oleorresinas está autorizada exclusivamente para los vinagres de vino y de fruta. En el caso de los vinos, se pueden utilizar aditivos aromatizantes o saborizantes como esencias naturales, aceites esenciales, extractos, bálsamos, oleorresinas, oleogomorresinas, compuestos aislados de esencias naturales o extractos, y compuestos químicos sápido-aromáticos sintéticos o artificiales, siempre y cuando estén permitidos por la normativa vigente. Es importante destacar que la aromatización en los vinos debe ser declarada en el rotulado de forma visible, y en caso de aromas artificiales, se debe indicar ""Aromatizado artificialmente"".","Artículo 1105
Queda prohibido fabricar, exponer, expender y anunciar productos o mezclas
destinados a mejorar o dar aroma a los vinos o mostos, así como colorantes,
edulcorantes o conservadores prohibidos, o cualquiera otra substancia que tenga por
objeto engañar al consumidor sobre sus cualidades esenciales, origen o clase o con el
fin de falsear los resultados analíticos o disimular una alteración.",0.0,0.8571428571428571,0.9549032515269497,0.0,Advanced
¿Los condimentos vegetales tienen algunas restricciones?,"['Los titulares de los establecimientos deberán tomar todas las medidas precautorias, desde\nlas materias primas y en todas las etapas de elaboración, procesamiento y distribución, para\nevitar la presencia no intencional de sustancias no compatibles con los criterios descriptos\nanteriormente para el uso de las leyendas: “Solo con ingredientes de origen vegetal”, “100%\nvegetal”, “Hecho a base de plantas”, “vegano” y “vegetariano”.\nLa declaración de alérgenos de origen animal, cuando exista la posibilidad de contaminación\naccidental durante el proceso de elaboración, aun habiendo aplicado las Buenas Prácticas de\nManufactura, no será un impedimento para identificar a los productos con las leyendas\ndetalladas en el presente artículo.', 'Con la denominación genérica de Especias o Condimentos vegetales, se comprenden ciertas\nplantas o partes de ellas que por contener sustancias aromáticas, sápidas o excitantes se\nemplean para aderezar, aliñar o mejorar el aroma y el sabor de los alimentos y bebidas.\nArtículo 1200\nDeben ser genuinas, sanas y responder a sus características normales, y estar exentas de\nsustancias extrañas y de partes de la planta de origen que no posean cualidades de\ncondimentos (tallos, pecíolos, etc).\nLas especias pueden expenderse enteras o molidas.\nLas especias que se tengan en depósito, exhiban, circulen o expendan en mal estado de\nconservación o atacadas por insectos o con olor a moho serán decomisadas en el acto, como', 'comúnmente agregados a las comidas, en pequeñas cantidades, el uso de las cuales es\nconsiderado aceptable con una posible limitación de algún principio activo en el producto\nfinal.\nN3.- Plantas o partes de las mismas, que en vista de su larga historia de uso sin evidencia de\nefectos adversos agudos, son aceptadas temporariamente para su uso en ciertas bebidas y\nalimentos, en su forma tradicional.\nEn estos casos las informaciones disponibles son insuficientes para determinar\nadecuadamente su potencial toxicidad a largo plazo. El uso de ciertos\nsaborizantes/aromatizantes de esta categoría puede estar limitado por la presencia de un\nprincipio activo con restricción de límite en el producto final.', 'podrán ser reemplazados por hasta el 2,0% de almidón.\n2. Dióxido de silicio, hasta 1,5%.\n3. Aceites esenciales y/o esencias artificiales hasta el 1,0%.\n4. Apio, orégano, cebolla, ajo u otras sustancias vegetales permitidas, deshidratadas y\nfinamente molidas, en cantidad no mayor al 25,0%.\nCuando se utilicen aromatizantes/saborizantes en la rotulación deberá consignarse la siguiente\ndenominación de venta: “Sal aromatizada/saborizada con …. (llenando el espacio en blanco con\nel nombre del aromatizante/saborizante utilizado)”.\nCuando se utilicen en la elaboración sustancias vegetales permitidas o sus mezclas, en la\nrotulación se consignará: “Sal con… (llenando el espacio en blanco con el nombre de la/s\nsustancia/s vegetal/es utilizada/s).”']","Sí, los condimentos vegetales tienen ciertas restricciones de acuerdo a la normativa. De acuerdo al contexto proporcionado, los condimentos vegetales deben ser genuinos, sanos y responder a sus características normales, estando exentos de sustancias extrañas y de partes de la planta de origen que no posean cualidades de condimentos. Además, se menciona que las especias que se encuentren en mal estado de conservación o atacadas por insectos deben ser decomisadas.

En cuanto a los ingredientes permitidos en los condimentos vegetales, se menciona que se pueden utilizar sustancias vegetales permitidas, deshidratadas y finamente molidas, en una cantidad no mayor al 25,0%. También se establece que cuando se utilicen aromatizantes o saborizantes en la elaboración de los condimentos, se debe indicar en la rotulación la denominación de venta correspondiente.

Por lo tanto, los condimentos vegetales deben cumplir con ciertos requisitos de calidad y pureza, así como respetar las normativas de etiquetado en cuanto a la información que debe incluirse en el envase.","CONDIMENTOS VEGETALES
Artículo 1199
Con la denominación genérica de Especias o Condimentos vegetales, se comprenden ciertas
plantas o partes de ellas que por contener sustancias aromáticas, sápidas o excitantes se
emplean para aderezar, aliñar o mejorar el aroma y el sabor de los alimentos y bebidas.
Artículo 1200
Deben ser genuinas, sanas y responder a sus características normales, y estar exentas de
sustancias extrañas y de partes de la planta de origen que no posean cualidades de
condimentos (tallos, pecíolos, etc).
Las especias pueden expenderse enteras o molidas.
Las especias que se tengan en depósito, exhiban, circulen o expendan en mal estado de
conservación o atacadas por insectos o con olor a moho serán decomisadas en el acto, como
asimismo las que han sido elaboradas en malas o deficientes condiciones de higiene.
Artículo 1201
Las mezclas de especias deben estar compuestas de especias simples, sanas, limpias y
genuinas, libres de productos extraños y deberán expenderse indicando en el rótulo los
componentes de la mezcla, y cada una debe responder a las especificaciones y características
analíticas propias.",0.999999999975,1.0,0.9130119220552734,1.0,Basic
¿Los condimentos vegetales tienen algunas restricciones?,"['Las especias o condimentos vegetales deben ser genuinas, sanas y responder a sus características normales. Además, deben estar exentas de sustancias extrañas y de partes de la planta de origen que no posean cualidades de condimentos. Se pueden expender enteras o molidas. Es importante que las especias se encuentren en buen estado de conservación, sin estar atacadas por insectos o con olor a moho, de lo contrario serán decomisadas.', 'Los condimentos vegetales pueden tener alguna restricción en cuanto al principio activo presente en el producto final. Algunos saborizantes/aromatizantes de origen vegetal pueden estar limitados por la presencia de un principio activo con restricción de límite en el producto final.', 'Sí, los condimentos vegetales tienen restricciones en cuanto a su cantidad en la mezcla de sal. Se permite el uso de sustancias vegetales permitidas, deshidratadas y finamente molidas, en una cantidad no mayor al 25,0%.', 'Sí, los condimentos vegetales tienen restricciones en cuanto a la cantidad que pueden ser adicionados en un producto. En el caso de vegetales en general, se permite adicionar hasta un 40% en total, con excepción de la moringa y la ortiga, las cuales no pueden superar el 5% del total. Para estos últimos casos, es necesario indicar en el rótulo el consumo máximo recomendado que represente el equivalente a 5 g diarios. Además, se establece que el porcentaje restante debe estar compuesto por yerba mate. El producto final no debe contener más de 9,5% de agua ni más del 2% de cenizas insolubles en ácido clorhídrico al 10% p/v, calculados ambos sobre producto seco. También se menciona que el producto se debe expender en envases bromatológicamente aptos.']","Sí, los condimentos vegetales tienen algunas restricciones. Por ejemplo, en cuanto a la cantidad que pueden ser adicionados en un producto, se permite adicionar hasta un 40% en total, con excepción de la moringa y la ortiga, las cuales no pueden superar el 5% del total. En estos casos especiales, es necesario indicar en el rótulo el consumo máximo recomendado que represente el equivalente a 5 g diarios. Además, se establece que el porcentaje restante debe estar compuesto por yerba mate. El producto final no debe contener más de 9,5% de agua ni más del 2% de cenizas insolubles en ácido clorhídrico al 10% p/v, calculados ambos sobre producto seco. También se menciona que el producto se debe expender en envases bromatológicamente aptos.","CONDIMENTOS VEGETALES
Artículo 1199
Con la denominación genérica de Especias o Condimentos vegetales, se comprenden ciertas
plantas o partes de ellas que por contener sustancias aromáticas, sápidas o excitantes se
emplean para aderezar, aliñar o mejorar el aroma y el sabor de los alimentos y bebidas.
Artículo 1200
Deben ser genuinas, sanas y responder a sus características normales, y estar exentas de
sustancias extrañas y de partes de la planta de origen que no posean cualidades de
condimentos (tallos, pecíolos, etc).
Las especias pueden expenderse enteras o molidas.
Las especias que se tengan en depósito, exhiban, circulen o expendan en mal estado de
conservación o atacadas por insectos o con olor a moho serán decomisadas en el acto, como
asimismo las que han sido elaboradas en malas o deficientes condiciones de higiene.
Artículo 1201
Las mezclas de especias deben estar compuestas de especias simples, sanas, limpias y
genuinas, libres de productos extraños y deberán expenderse indicando en el rótulo los
componentes de la mezcla, y cada una debe responder a las especificaciones y características
analíticas propias.",0.999999999975,1.0,0.9137425177492076,1.0,Advanced
¿Qué caracteristicas debe tener la harina de chia?,"['Las harinas de soja no tostadas podrán ser usadas con fines industriales, siempre que los\nprocesos a que se someten con posterioridad aseguren una efectiva inactivación de los\nfactores nutritivos y microbiológicos.”\nArtículo 1407 bis – (Resolución Conjunta SPReI N° 86/2009 y SAGPyA N°\n711/2009)\n“Con la denominación de Harina de Chía, se entiende el producto proveniente de la\nmolienda de la semilla de chía (Salvia hispana L.) debiendo presentar esta última,\ncaracterísticas de semillas sanas, limpias y bien conservadas, que han sido sometidas a\nprensado para la remoción parcial o prácticamente total del aceite que contienen.\nLos diversos tipos de Harina de Chía que se consideran responderán a las siguientes\ncaracterísticas:\nHarina de Chía', 'Harina de Chía\tNone\tNone\n\tParcialmente Desgrasada\tDesgrasada\nPor ciento\tNone\tNone\nHumedad (100 -105º C) máx.\t9\t5\nProteína (N x 6.25) mín.\t20\t29\nGrasa (extracto etéreo) máx.\t18\t7\nFibra Total máx.\t35\t52\nCenizas (500 - 550º C) máx.\t5\t6', 'La denominación de venta será Harina de Chía Desgrasada o Harina de Chía Parcialmente\nDesgrasada, según corresponda.”\nArtículo 1407 tris - (Resolución Conjunta SCS y SAGyP N° 31/2023)\n“La harina de semilla de cáñamo es la proveniente de la molienda de la torta de semillas de\ncáñamo autorizadas en el presente Código que han sido sometidas a un proceso para la\nremoción parcial o prácticamente total del aceite que contienen. De acuerdo al nivel de\nremoción de aceite, las harinas podrán clasificarse como parcialmente desgrasada o\ndesgrasada. El contenido mínimo de proteína (N x 6,25) será de 20% (b.s.).\nPodrán presentar diferentes granulometrías, entre 180 y 350 micrómetros.\nDeberá cumplir con los siguientes criterios microbiológicos:', 'procesamiento y/o forma de consumo, de corresponder.”\nArtículo 918 - (Resolución Conjunta SPReI N° 169/2013 y SAGyP N° 230/2013)\n“Con la denominación de semillas de chía se entienden las semillas sanas, limpias y bien\nconservadas de Salvia hispánica L.\nDeberán cumplir con las siguientes especificaciones:\nLas semillas de chía, que respondan a la especie mencionada, serán de color marrón oscuro, de\ntamaño muy pequeño y de buena fluidez.\nEl aroma deberá ser suave, agradable y propio de la semilla.\nAgua a 100 – 105 ºC: máximo 7%\nMateria grasa: mínimo 33%.\nNo deberán contener más de 0,5% de semillas dañadas.\nEstarán libres de insectos vivos.\nNo deberán contener más de 1% de materias extrañas, de las cuales no más de 0,25% será de', 'c. Los granos serán de consistencia razonablemente tierna y ofrecerán cierto grado de\nresistencia a la masticación, sin llegar a resultar duros o correosos.\nd. El contenido de un mismo envase deberá presentar granos de la misma variedad y de\ncoloración normal para el tipo respectivo.\ne. El contenido de granos de choclo escurridas en los envases de cualquier tamaño no será\nmenor del 58% en peso, del peso en agua destilada a 20°C que cabe en el recipiente\ntotalmente lleno y cerrado.\nEste producto se rotulará: Maíz dulce o Granos de choclo y formando una sola frase con letras\ndel mismo tipo, realce y visibilidad, se indicará el color del grano (blanco, amarillo o dorado) y\nel tipo de maíz (grano entero).']","La harina de chía debe tener las siguientes características:
- Debe provenir de la molienda de la semilla de chía (Salvia hispana L.).
- La semilla de chía debe ser sana, limpia y bien conservada, habiendo sido sometida a prensado para la remoción parcial o total del aceite que contiene.
- Puede ser desgrasada o parcialmente desgrasada.
- Debe cumplir con los siguientes valores:
  - Humedad máxima entre 9% y 5%.
  - Proteína mínima entre 20% y 29%.
  - Grasa máxima entre 18% y 7%.
  - Fibra total máxima entre 35% y 52%.
  - Cenizas máximas entre 5% y 6%.
- La denominación de venta será Harina de Chía Desgrasada o Harina de Chía Parcialmente Desgrasada, según corresponda.","“Con la denominación de Harina de Chía, se entiende el producto proveniente de la
molienda de la semilla de chía (Salvia hispana L.) debiendo presentar esta última,
características de semillas sanas, limpias y bien conservadas, que han sido sometidas a
prensado para la remoción parcial o prácticamente total del aceite que contienen.
Los diversos tipos de Harina de Chía que se consideran responderán a las siguientes
características:
Harina de Chía
Parcialmente Desgrasada Desgrasada
Por ciento
Humedad (100 -105º C) máx. 9 5
Proteína (N x 6.25) mín. 20 29
Grasa (extracto etéreo) máx. 18 7
Fibra Total máx. 35 52
Cenizas (500 - 550º C) máx. 5 6
Granulometría: 0.5 - 1 mm.
Color: marrón grisáceo.
Sabor y aroma: suave, agradable, propio de la semilla.
Los límites máximos de tolerancia de contaminantes inorgánicos serán los establecidos en el
presente Código.
Criterios microbiológicos:
Coliformes Totales, máx. 100 UFC/g
Coliformes Fecales (E. coli) Ausencia en 1g
Salmonella sp. Ausencia en 25g
Clostridium, sp. (Sulfito reductores) Ausencia en 1g
Staphilococcus sp. Ausencia en 1g
Recuento total de hongos y levaduras, máx. 100 UFC/g
Aflatoxinas máx. 0,03 μg/kg
La denominación de venta será Harina de Chía Desgrasada o Harina de Chía Parcialmente
Desgrasada, según corresponda.”",0.99999999998,0.5333333333333333,0.9185545642165612,0.6153846153846154,Basic
¿Qué caracteristicas debe tener la harina de chia?,"['Las características que debe tener la harina de chía son:\n- Provenir de la molienda de la semilla de chía (Salvia hispana L.).\n- Las semillas deben ser sanas, limpias y bien conservadas.\n- Deben haber sido sometidas a prensado para la remoción parcial o total del aceite que contienen.', 'Proteína (N x 6.25) mínima: 29%\nGrasa (extracto etéreo) máxima: 7%\nFibra Total máxima: 52%\n<irrelevant>', 'Las características que debe tener la harina de chia según el fragmento son:\n- Deben ser semillas de chía de color marrón oscuro, de tamaño muy pequeño y de buena fluidez.\n- El aroma debe ser suave, agradable y propio de la semilla.\n- El contenido de agua debe ser máximo 7%.\n- El contenido de materia grasa debe ser mínimo 33%.\n- No deben contener más de 0,5% de semillas dañadas.\n- Deben estar libres de insectos vivos.\n- El contenido de materias extrañas no debe ser más de 1%, de las cuales no más de 0,25% será de.', 'La harina de chia debe tener las siguientes características:\n- Humedad máxima de 9%.\n- Proteína mínima de 35%.\n- Grasa máxima de 2%.\n- Fibra cruda máxima de 3,5%.\n- Cenizas máximas de 6,5%.\n- Granulometría: el 95% debe pasar por un tamiz de 149 micrones.\n- En caso de ser harina tostada, debe cumplir con requisitos de valor nutritivo y de inocuidad, como un mínimo de 5g de lisina disponible por 16g de N, un PER mínimo de 2,0, un UPN mínimo de 60,0 y una actividad ureásica máxima de 0,30. Además, debe cumplir con la ausencia de Salmonella en 25g según el método de ensayo ISO 6579-1:2017.', '- La harina de chia debe tener un tenor en nitrógeno no menor de 1,12%.\n- No debe contener más de 1,0% de cenizas a 500°-550°C (base húmeda).\n- La harina de chia no debe tener más de 3,0% de materia grasa (base húmeda).\n- No debe dejar residuo al pasar por un tamiz de 350 micrones de luz de malla.\n- La harina de chia no debe contener harina de otros cereales ni cuerpos extraños al maíz.']","La harina de chía debe tener las siguientes características según el fragmento proporcionado:
- Provenir de la molienda de la semilla de chía (Salvia hispana L.).
- Las semillas deben ser sanas, limpias y bien conservadas.
- Deben haber sido sometidas a prensado para la remoción parcial o total del aceite que contienen.
- Deben ser semillas de chía de color marrón oscuro, de tamaño muy pequeño y de buena fluidez.
- El aroma debe ser suave, agradable y propio de la semilla.
- El contenido de agua debe ser máximo 7%.
- El contenido de materia grasa debe ser mínimo 33%.
- No deben contener más de 0,5% de semillas dañadas.
- Deben estar libres de insectos vivos.
- El contenido de materias extrañas no debe ser más de 1%, de las cuales no más de 0,25% será de.
- Humedad máxima de 9%.
- Proteína mínima de 35%.
- Grasa máxima de 2%.
- Fibra cruda máxima de 3,5%.
- Cenizas máximas de 6,5%.
- Granulometría: el 95% debe pasar por un tamiz de 149 micrones.
- En caso de ser harina tostada, debe cumplir con requisitos de valor nutritivo y de inocuidad, como un mínimo de 5g de lisina disponible por 16g de N, un PER mínimo de 2,0, un UPN mínimo de 60,0 y una actividad ureásica máxima de 0,30. Además, debe cumplir con la ausencia de Salmonella en 25g según el método de ensayo ISO 6579-1:2017.
- La harina de chía debe tener un tenor en nitrógeno no menor de 1,12%.
- No debe contener más de 1,0% de cenizas a 500°-550°C (base húmeda).
- La harina de chía no debe tener más de 3,0% de materia grasa (base húmeda).
- No debe dejar residuo al pasar por un tamiz de 350 micrones de luz de malla.
- La harina de chía no debe contener harina de otros cereales ni cuerpos extraños al maíz.","“Con la denominación de Harina de Chía, se entiende el producto proveniente de la
molienda de la semilla de chía (Salvia hispana L.) debiendo presentar esta última,
características de semillas sanas, limpias y bien conservadas, que han sido sometidas a
prensado para la remoción parcial o prácticamente total del aceite que contienen.
Los diversos tipos de Harina de Chía que se consideran responderán a las siguientes
características:
Harina de Chía
Parcialmente Desgrasada Desgrasada
Por ciento
Humedad (100 -105º C) máx. 9 5
Proteína (N x 6.25) mín. 20 29
Grasa (extracto etéreo) máx. 18 7
Fibra Total máx. 35 52
Cenizas (500 - 550º C) máx. 5 6
Granulometría: 0.5 - 1 mm.
Color: marrón grisáceo.
Sabor y aroma: suave, agradable, propio de la semilla.
Los límites máximos de tolerancia de contaminantes inorgánicos serán los establecidos en el
presente Código.
Criterios microbiológicos:
Coliformes Totales, máx. 100 UFC/g
Coliformes Fecales (E. coli) Ausencia en 1g
Salmonella sp. Ausencia en 25g
Clostridium, sp. (Sulfito reductores) Ausencia en 1g
Staphilococcus sp. Ausencia en 1g
Recuento total de hongos y levaduras, máx. 100 UFC/g
Aflatoxinas máx. 0,03 μg/kg
La denominación de venta será Harina de Chía Desgrasada o Harina de Chía Parcialmente
Desgrasada, según corresponda.”",0.99999999998,1.0,0.8842361440527053,0.5384615384615384,Advanced
¿Quiénes deben cumplir con la regulación alimentaria?,"['2.1.1. Los productores deben cumplir con la inscripción en el Registro Nacional Sanitario de\nProductores Agropecuarios (RENSPA).\n2.1.2. Los productores deberán identificar los alimentos fruti-hortícolas producidos, empleando\netiqueta/rótulo, consignándose los datos previstos en normativa vigente.\n2.1.3. Los productores deberán trasladar los productos fruti-hortícolas producidos, empleando\nel Documento de Tránsito Sanitario Vegetal (DTV), cuando las autoridades sanitarias lo exijan,\nprevisto en normativa vigente.\n2.2. Productos fitosanitarios\n2.2.1. Los productores deberán cumplir con las recomendaciones y las restricciones de uso,\nindicadas en el marbete/etiqueta y registrar la aplicación.', 'de cumplimiento obligatorio por parte de los elaboradores no siendo exigible presentación\nalguna ante cualquier Autoridad Sanitaria.\nANEXO\nREGLAMENTO TÉCNICO MERCOSUR DE PORCIONES DE ALIMENTOS ENVASADOS A\nLOS FINES DEL ROTULADO NUTRICIONAL\n1. ÁMBITO DE APLICACIÓN\nEl presente Reglamento Técnico se aplicará al rotulado nutricional de los alimentos que se\nproduzcan y comercialicen en el territorio de los Estados Partes del MERCOSUR, al comercio\nentre ellos y a las importaciones extrazona, envasados en ausencia del cliente, listos para\nofrecerlos a los consumidores.\nEl presente Reglamento Técnico se aplicará sin perjuicio de las disposiciones establecidas en\nlos Reglamentos Técnicos MERCOSUR vigentes en materia de rotulación de alimentos', 'asumidas conjuntamente entre el/los titulares del establecimiento, el/los elaborador/es de los\nproductos y el responsable técnico.\nEl Responsable Técnico podrá ser un Técnico, Técnico Superior o Profesional que, a juicio de la\nautoridad sanitaria competente, esté capacitado para cumplir con las funciones definidas en el\npresente Código y, además, para supervisar y coordinar las tareas de los elaboradores y llevar\nregistro/libro de los convenios/acuerdos escritos cuando correspondiere.\nArtículo 153\nLas Casas de Comida y Pensiones deben inscribirse en los registros de la autoridad sanitaria.\nArtículo 154 - Derogado por Resolución Conjunta SAGyP y SCS Nº 19/2023\nArtículo 154 bis - (Resolución Conjunta SCS y SAByDR N° 4/2020)\nI. CARGA DE ALIMENTOS', 'El rótulo de los suplementos dietarios deberá cumplir con los requisitos generales establecidos\nen el Capítulo V “Normas para la rotulación y publicidad de los alimentos” y los que en cada\ncaso particular se determinen en el presente código.\nAdemás, la información nutricional deberá incluir el nombre de los nutrientes y/o ingredientes\nde interés, sus contenidos por unidad o por recomendación de consumo diaria propuesta por\nel elaborador y en el caso de corresponder, el porcentaje de la IDR cubierto para cada uno de\nellos, de acuerdo a los valores establecidos en las tablas del artículo 1387.\nCuando existiera envase secundario la información mínima del envase primario (blister,\nampolla) deberá ser lote, fecha de vencimiento y marca.', 'Así, el CODEX ALIMENTARIUS y la I.C.M.S.F. continuamente han editado documentación\nnormativa que reglamenta el tema.\nConsiderando que los países que integran el MERCOSUR integran y participan activamente\nen la elaboración de los documentos del CODEX ALIMENTARIUS y de la I.C.M.S.F., estos\núltimos podrán ser tomados como referencia.\nCRITERIOS Y PATRONES APLICABLES A LA MICROBIOLOGÍA DE ALIMENTOS.\nPrincipios generales para su establecimiento\nDefinición de los criterios microbiológicos para los alimentos:\n1.-Caracterización de los microorganismos y/o sus toxinas considerados de interés. Con esta\nfinalidad los microorganismos comprenden bacterias, virus, hongos y levaduras.\n2.-Clasificación de los alimentos según su riesgo epidemiológico.', '1. Toda persona que realice actividades por la cual esté o pudiera estar en contacto con\nalimentos, en establecimientos donde se elaboren, fraccionen, almacenen, transporten,\ncomercialicen y/o enajenen alimentos, o sus materias primas, debe estar provista de un\nCARNET DE MANIPULADOR DE ALIMENTOS, expedido por la autoridad sanitaria competente,\ncon validez en todo el territorio nacional.\n2. Cada jurisdicción implementará el sistema de otorgamiento del CARNET DE MANIPULADOR\nde conformidad con lo prescrito en el presente artículo.\n3. Es responsabilidad del empleador garantizar las condiciones necesarias para que el\nmanipulador de alimentos cumplimente en forma adecuada la obtención del CARNET.']","Los productores agropecuarios deben cumplir con la regulación alimentaria, incluyendo la inscripción en el Registro Nacional Sanitario de Productores Agropecuarios (RENSPA), la identificación de alimentos fruti-hortícolas con etiquetas que cumplan con la normativa vigente, y el traslado de productos fruti-hortícolas con el Documento de Tránsito Sanitario Vegetal (DTV) cuando sea requerido por las autoridades sanitarias. Además, las Casas de Comida y Pensiones también deben cumplir con la regulación alimentaria al inscribirse en los registros de la autoridad sanitaria. Es importante destacar que toda persona que realice actividades relacionadas con alimentos debe contar con un Carnet de Manipulador de Alimentos expedido por la autoridad sanitaria competente.","Artículo 1
Toda persona, firma comercial o establecimiento que elabore, fraccione, conserve, transporte,
expenda, exponga, importe o exporte alimentos, condimentos, bebidas o primeras materias
correspondientes a los mismos y aditivos alimentarios debe cumplir con las disposiciones del
presente Código.",0.9266666666481332,1.0,0.8469854716676375,1.0,Basic
¿Quiénes deben cumplir con la regulación alimentaria?,"['Los productores deben cumplir con la regulación alimentaria al inscribirse en el Registro Nacional Sanitario de Productores Agropecuarios (RENSPA), identificar los alimentos fruti-hortícolas con etiquetas que cumplan con la normativa vigente, y trasladar los productos fruti-hortícolas con el Documento de Tránsito Sanitario Vegetal (DTV) cuando sea requerido por las autoridades sanitarias.', 'Todos aquellos que realicen actividades en establecimientos donde se elaboren, fraccionen, almacenen, transporten, comercialicen y/o enajenen alimentos, o sus materias primas, deben cumplir con la regulación alimentaria al obtener un Carnet de Manipulador de Alimentos expedido por la autoridad sanitaria competente.', 'Las empresas que elaboren alimentos para propósitos médicos específicos deben cumplir con la regulación alimentaria implementando un Sistema de Análisis de Peligros y Puntos Críticos de Control (HACCP) según lo establecido en el Artículo 18 bis del código mencionado.', 'Los establecimientos elaboradores de envases y utensilios alimentarios en contacto con alimentos deben cumplir con la regulación alimentaria al contar con un Director Técnico, el cual debe ser un profesional universitario, un técnico superior o un técnico capacitado según lo establecido en el Código. <irrelevant>', 'Los elaboradores de alimentos deben cumplir con la regulación alimentaria establecida en las Resoluciones MERCOSUR. En este caso, se menciona que cualquier modificación en la composición, formulación o rotulado de los alimentos en virtud de las Resoluciones MERCOSUR debe ser cumplida obligatoriamente por los elaboradores, sin necesidad de presentación ante ninguna Autoridad Sanitaria.', 'Todos aquellos que elaboren, fraccionen, conserven, transporten, expendan, expongan, importen o exporten alimentos, condimentos, bebidas o materias primas correspondientes a los mismos y aditivos alimentarios deben cumplir con la regulación alimentaria.']","Quienes deben cumplir con la regulación alimentaria son los productores agropecuarios al inscribirse en el Registro Nacional Sanitario de Productores Agropecuarios (RENSPA), identificar los alimentos fruti-hortícolas con etiquetas que cumplan con la normativa vigente, y trasladar los productos fruti-hortícolas con el Documento de Tránsito Sanitario Vegetal (DTV) cuando sea requerido por las autoridades sanitarias. Asimismo, todos aquellos que realicen actividades en establecimientos donde se elaboren, fraccionen, almacenen, transporten, comercialicen y/o enajenen alimentos, o sus materias primas, deben cumplir con la regulación alimentaria al obtener un Carnet de Manipulador de Alimentos expedido por la autoridad sanitaria competente. Además, las empresas que elaboren alimentos para propósitos médicos específicos deben cumplir con la regulación alimentaria implementando un Sistema de Análisis de Peligros y Puntos Críticos de Control (HACCP) según lo establecido en el Artículo 18 bis del código mencionado. Los establecimientos elaboradores de envases y utensilios alimentarios en contacto con alimentos deben cumplir con la regulación alimentaria al contar con un Director Técnico, el cual debe ser un profesional universitario, un técnico superior o un técnico capacitado según lo establecido en el Código. Además, los elaboradores de alimentos deben cumplir con la regulación alimentaria establecida en las Resoluciones MERCOSUR, donde cualquier modificación en la composición, formulación o rotulado de los alimentos en virtud de las Resoluciones MERCOSUR debe ser cumplida obligatoriamente por los elaboradores, sin necesidad de presentación ante ninguna Autoridad Sanitaria. En resumen, todos aquellos que elaboren, fraccionen, conserven, transporten, expendan, expongan, importen o exporten alimentos, condimentos, bebidas o materias primas correspondientes a los mismos y aditivos alimentarios deben cumplir con la regulación alimentaria.","Artículo 1
Toda persona, firma comercial o establecimiento que elabore, fraccione, conserve, transporte,
expenda, exponga, importe o exporte alimentos, condimentos, bebidas o primeras materias
correspondientes a los mismos y aditivos alimentarios debe cumplir con las disposiciones del
presente Código.",0.8766666666491333,1.0,0.9999999999999997,1.0,Advanced
¿Qué se define como aditivo alimentario?,"['sus procesos biológicos. La designación ""alimento"" incluye además las substancias o mezclas\nde substancias que se ingieren por hábito, costumbres, o como coadyuvantes, tengan o no\nvalor nutritivo.\n3. Aditivo alimentario: Cualquier substancia o mezcla de substancias que directa o\nindirectamente modifiquen las características físicas, químicas o biológicas de un alimento, a\nlos efectos de su mejoramiento, preservación, o estabilización, siempre que:\na) Sean inocuos por sí mismos o a través de su acción como aditivos en las condiciones de\nuso.\nb) Su empleo se justifique por razones tecnológicas, sanitarias, nutricionales o\npsicosensoriales necesarias.\nc) Respondan a las exigencias de designación y de pureza que establezca este Código.', 'elaboración, contaminante y los principios fundamentales referentes al empleo de aditivos\nalimenticios, conforme a lo siguiente:\nIngredientes: es toda sustancia, incluidos los aditivos alimentarios, que se emplee en la\nfabricación o preparación de un alimento y esté presente en el producto final en su forma\noriginal o modificada.\nAditivo alimentario: es cualquier ingrediente agregado a los alimentos intencionalmente, sin\nel propósito de nutrir, con el objeto de modificar las características físicas, químicas, biológicas\no sensoriales, durante la manufactura, procesado, preparación, tratamiento, envasado,\nacondicionado, almacenado, transporte o manipulación de un alimento; podrá resultar que el', 'alimentos, los respectivos límites de composición, la migración específica y las restricciones de\nuso, así como definir el método de cálculo y el uso de factores de corrección.\n3. DEFINICIONES\n3.1 Aditivo: sustancia que se añade intencionadamente a la formulación del material para\nobtener un efecto físico o químico durante la fabricación del plástico o en el material u objeto\nfinal; su presencia en el material u objeto final es intencionada.\n3.2 Coadyuvante de polimerización: toda sustancia usada para aportar un medio adecuado para\nla fabricación de un polímero, un plástico o un revestimiento polimérico; puede estar presente,\npero ni es intencionado que esté presente en los materiales u objetos finales ni tiene efecto', 'biológicas o sensoriales, durante la manufactura, procesado, preparación, tratamiento,\nenvasado, acondicionado, almacenado, transporte o manipulación de un alimento; ello\ntendrá, o puede esperarse razonablemente que tenga (directa o indirectamente), como\nresultado, que el propio aditivo o sus productos se conviertan en un componente de dicho\nalimento. Este término no incluye a los contaminantes o a las sustancias nutritivas que se\nincorporan a un alimento para mantener o mejorar sus propiedades nutricionales.\n2.8 - Alimento- Es toda sustancia que se ingiere en estado natural, semielaborada o elaborada\ny se destina al consumo humano, incluidas las bebidas y cualquier otra sustancia que se utilice', 'propio aditivo o sus derivados se conviertan en un componente de dicho alimento. Esta\ndefinición no incluye a los contaminantes o a las sustancias nutritivas que se incorporan a un\nalimento para mantener o mejorar sus propiedades nutricionales.\nRESOLUCIÓN GMC N° 18/93 Sustitúyase el texto de la definición de Coadyudante de\nElaboración de productos alimentarios incluidos en el artículo 1º de la Resolución GMC Nº\n31/92 por el siguiente:\nCoadyuvante de Tecnología es toda sustancia, excluyendo los equipamientos y los\nutensilios, que no se consume por si sola como ingrediente alimenticio y que se emplea\nintencionalmente en la elaboración de materias primas, alimentos o sus ingredientes, para', '2.3- Alimento envasado- Es todo alimento que está contenido en un envase listo para ofrecerlo\nal consumidor.\n2.4 - Consumidor- Es toda persona física o jurídica que adquiere o utiliza alimentos.\n2.5 - Ingrediente- Es toda sustancia, incluidos los aditivos alimentarios, que se emplee en la\nfabricación o preparación de alimentos y que esté presente en el producto final en su forma\noriginal o modificada.\n2.6 - Materia prima- Es toda sustancia que para ser utilizada como alimento necesita sufrir\ntratamiento y/o transformación e naturaleza física, química o biológica.\n2.7 - Aditivo alimentario- Es cualquier ingrediente agregado a los alimentos intencionalmente,\nsin el propósito de nutrir, con el objeto de modificar las características físicas, químicas,', 'siguiendo un orden diferente siempre que la lista de dichos ingredientes vaya acompañada\nde la mención “en proporción variable”.\n6.2.3. Declaración de aditivos alimentarios en la lista de ingredientes. Los aditivos\nalimentarios deberán declararse formando parte de la lista de ingredientes. Esta declaración\nconstará de:\na) la función principal o fundamental del aditivo en el alimento, y\nb) su nombre completo, o su número INS (Sistema Internacional de Numeración, CODEX\nALIMENTARIOS FAO/OMS), o ambos.\nCuando entre los aditivos alimentarios haya más de uno con la misma función, podrán\nmencionarse uno a continuación de otro, agrupándolos por función.\nLos aditivos alimentarios serán declarados después del resto de los ingredientes.', 'un aditivo en alimentos deberá haberse sometido a una adecuada evaluación toxicológica en\nla que se deberá tener en cuenta, entre otros aspectos, cualquier efecto acumulativo,\nsinérgico o de protección producida por su uso; los aditivos alimentarios deberán\nmantenerse en observación y revaluarse cuando sea necesario si cambian las condiciones de\nuso, debiéndose estar al tanto de las informaciones científicas que aparezcan sobre este\ntema;\nB) La restricción de uso de los aditivos, establece que el uso deberá limitarse a alimentos\nespecíficos, en condiciones específicas y al nivel mínimo para lograr el efecto deseado;\nC) La necesidad tecnológica de uso de un aditivo solo será justificado cuando proporciona', 'El empleo de aditivos alimentarios se hará solamente en los casos especificamente\nautorizados, cumpliendo todos los requisitos que este Código establece sobre el particular"".\nArtículo 175\nCon el nombre de Conservas alimenticias, se entienden los productos de origen animal o\nvegetal que, envasados en forma hermética, han sido sometidos, antes o después de su\nenvasamiento, a procesos de conservación autorizados.\nArtículo 176\nQueda prohibido fabricar conservas alimenticias para su expendio:\n1. En los establecimientos no autorizados.\n2. Con substancias alteradas, averiadas, infectadas, mal conservadas, carentes de\npropiedades nutritivas o que por cualquier motivo resulten inadecuadas para la\nalimentación.']","Un aditivo alimentario se define como cualquier sustancia o mezcla de sustancias que directa o indirectamente modifiquen las características físicas, químicas o biológicas de un alimento con el fin de mejorar, preservar o estabilizar el alimento. Para considerarse un aditivo alimentario, debe ser inocuo por sí mismo o a través de su acción como aditivo en las condiciones de uso, su empleo debe justificarse por razones tecnológicas, sanitarias, nutricionales o psicosensoriales necesarias, y debe cumplir con las exigencias de designación y pureza establecidas en el código de regulaciones alimentarias.","Aditivo alime ntario: es cualquier ingrediente agregado a los alimentos intencionalmente, sin
el propósito de nutrir, con el objeto de modificar las características físicas, químicas, biológicas
o sensoriales, durante la manufactura, procesado, preparación, tratamiento, envasado,
acondicionado, almacenado, transporte o manipulación de un alimento; podrá resultar que el
propio aditivo o sus derivados se conviertan en un componente de dicho alimento. Esta
definición no incluye a los contaminantes o a las sustancias nutritivas que se incorporan a un
alimento para mantener o mejorar sus propiedades nutricionales.",0.9999999999888889,1.0,0.9143357456930655,1.0,Basic
¿Qué se define como aditivo alimentario?,"['Según el texto proporcionado, se define como aditivo alimentario a cualquier substancia o mezcla de substancias que directa o indirectamente modifiquen las características físicas, químicas o biológicas de un alimento con el fin de mejorar, preservar o estabilizar el alimento. Es importante que los aditivos alimentarios sean inocuos por sí mismos o a través de su acción como aditivos en las condiciones de uso, que su empleo esté justificado por razones tecnológicas, sanitarias, nutricionales o psicosensoriales necesarias, y que cumplan con las exigencias de designación y pureza establecidas en el código mencionado.', 'Un aditivo alimentario se define como cualquier ingrediente agregado a los alimentos intencionalmente, sin el propósito de nutrir, con el objeto de modificar las características físicas, químicas, biológicas o sensoriales durante diferentes etapas de la producción y manipulación de un alimento.', 'Aditivo alimentario se define como una sustancia que se añade intencionadamente a la formulación de un material para obtener un efecto físico o químico durante la fabricación del plástico o en el material u objeto final, y su presencia en el material u objeto final es intencionada.', 'Aditivo alimentario se define como cualquier ingrediente agregado a los alimentos intencionalmente, sin el propósito de nutrir, con el objeto de modificar las características físicas, químicas.', 'Los aditivos alimentarios se definen como aquellos que están incluidos en la lista que constituye el Anexo A del Reglamento Técnico del Mercosur sobre GMC Aditivos Alimentarios. Estos aditivos pueden ser usados en los alimentos en general, según las Buenas Prácticas de Fabricación, sin limitaciones cuantitativas, siempre y cuando cumplan funciones determinadas y estas funciones estén autorizadas en el alimento en cuestión.', 'Se define como aditivo alimentario a las sustancias permitidas para productos alimenticios, que pueden ser saborizados o no, con o sin agentes químicos y/o biológicos autorizados, a los que se les da formas variadas. Además, se menciona que los aditivos permitidos son los incluidos en la Resolución Grupo Mercado Común (GMC) Nº 2/08 incorporada al CAA por la Resolución Conjunta N° 203 y N° 569 de fecha 25 de noviembre de 2008.', 'Los aditivos alimentarios se definen en el Artículo 6°, Inc 3 del Código como sustancias que deben ser inocuas por sí mismas o a través de su acción como aditivos en las condiciones de uso, formar parte de la lista positiva de aditivos alimentarios del Código, ser empleados exclusivamente en los alimentos mencionados en el Código y cumplir con las exigencias de designación, composición, identificación y pureza establecidas en el Código.', 'Los aditivos alimentarios se definen como sustancias que se agregan a los alimentos con el propósito de mantener o mejorar su valor nutritivo, aumentar su estabilidad o capacidad de conservación, incrementar la aceptabilidad de alimentos sanos pero poco atractivos, y permitir la elaboración económica y en gran escala de alimentos con composición y calidad constantes en el tiempo.', 'Un aditivo alimentario se define como aquellas sustancias que han sido evaluadas y consideradas por el Joint FAO/WHO Expert Committee on Food Additives (JECFA), excluyendo en este caso las enzimas, el ácido ascórbico, el alginato de calcio, el carbonato de calcio, el carbonato de sodio, el bicarbonato de sodio, el carbonato de potasio y el cloruro de potasio.']","Un aditivo alimentario se define como cualquier substancia o mezcla de substancias que directa o indirectamente modifiquen las características físicas, químicas o biológicas de un alimento con el fin de mejorar, preservar o estabilizar el alimento. Es importante que los aditivos alimentarios sean inocuos por sí mismos o a través de su acción como aditivos en las condiciones de uso, que su empleo esté justificado por razones tecnológicas, sanitarias, nutricionales o psicosensoriales necesarias, y que cumplan con las exigencias de designación y pureza establecidas en el código mencionado.","Aditivo alime ntario: es cualquier ingrediente agregado a los alimentos intencionalmente, sin
el propósito de nutrir, con el objeto de modificar las características físicas, químicas, biológicas
o sensoriales, durante la manufactura, procesado, preparación, tratamiento, envasado,
acondicionado, almacenado, transporte o manipulación de un alimento; podrá resultar que el
propio aditivo o sus derivados se conviertan en un componente de dicho alimento. Esta
definición no incluye a los contaminantes o a las sustancias nutritivas que se incorporan a un
alimento para mantener o mejorar sus propiedades nutricionales.",0.9999999999888889,1.0,0.8880137085426046,0.3333333333333333,Advanced
¿Cuáles son los límites de metales aceptados en los alimentos?,"['PARTE I\n1- Criterios Generales:\n1.1 - En los alimentos contemplados en el presente Reglamento se admite la presencia de\nlos elementos metálicos y no metálicos, dentro de los límites establecidos, conforme lo\nindicado en la Parte II.\n1.2 - El presente Reglamento Técnico no se aplica a los alimentos para lactantes y niños de\ncorta edad, los que se regirán por los Reglamentos Técnicos específicos.\n1.3 - Los niveles de contaminantes inorgánicos en los alimentos deberán ser lo más bajos\nposibles, debiendo prevenirse la contaminación del alimento en la fuente, aplicar la\ntecnología más apropiada en la producción, manipulación, almacenamiento, procesamiento y\nenvasado, a fin de evitar que un alimento contaminado sea comercializado o consumido.', 'Metal\tCriterio de aceptación\tMetodología\nCadmio (Cd)\t< 1000 µg / kilo de carne de moluscos\tEspectrometría de\nAbsorción Atómica\nPlomo (Pb)\t< 1000 µg / kilo de carne de moluscos\tNone\nMercurio (Hg)\t< 500 µg / kilo de carne de moluscos\tNone', '""Los envases metálicos no deberán ceder plomo, cinc, antimonio, cobre, cromo, hierro, estaño, en\ncantidades superiores a las establecidas en el Artículo 156, ni otros contaminantes constituidos por\nmetales o metaloides que puedan considerarse nocivos.\nLas pruebas de cesión podrán efectuarse de acuerdo al siguiente esquema en base a la\ncaracterización convencional de tres productos alimenticios básicos y las respectivas soluciones a\nutilizarse para ensayar la transferencia de metales.\nTipo 1 - Productos acuosos ácidos y no ácidos, esterilizados en su envase por acción del calor, que\npueden contener sal y/o azúcar e incluir emulsiones aceite/agua, o bajo contenido de grasa.', 'alimento a envasar no sea de tipo acuoso ácido.\nSobre los extractos se determinan los metales y otros elementos usando técnicas\nespectrométricas de la mayor selectividad y sensibilidad disponibles.\nLos límites de migración específica (LME) de los elementos a determinar son los siguientes:\nElemento LME en mg/kg\nAntimonio (Sb) 0,04\nArsénico (As) 0,01\nBario (Ba) 1\nBoro (B) 0,5\nCadmio (Cd) 0,005\nCinc (Zn) 25\nCobre (Cu) 5\nCromo (Cr) 0,05\nEstaño (Sn) 1,2\nFlúor (F) 0,5\nMercurio (Hg) 0,005\nPlata (Ag) 0,05\nPlomo (Pb) 0,01\nLa determinación del contenido de metales y metaloides en los extractos se debe llevar a\ncabo utilizando técnicas espectrométricas de cuantificación con sensibilidad adecuada para\nverificar el cumplimiento de los límites establecidos.', 'necesario para los alimentos que no requieren ser esterilizados o sometidos a otro tipo de\ntratamiento térmico para su conservación.\n2.7. Queda permitido reciclar los materiales metálicos, siempre que los mismos sean sometidos a\nun proceso que permita cumplir las especificaciones del presente Reglamento.\n2.8. Los materiales metálicos no deben contener más de 1% (m/m) de impurezas constituidas por\nplomo, arsénico, cadmio, mercurio, antimonio y cobre considerados en conjunto. El límite\nindividual de arsénico, mercurio y plomo no debe ser mayor de 0,01% (m/m).\n2.9. Los metales contaminantes no deberán migrar en cantidades superiores a los límites\nestablecidos en el Reglamento Técnico MERCOSUR sobre contaminantes inorgánicos en alimentos o', 'alimentos, pueden utilizarse todo tipo de colorantes siempre que los mismos no puedan ser\ncedidos al alimento y no contengan metales en cantidades superiores a los siguientes\nporcentajes:\nArsénico 0,005% soluble en NaOH lN\nBario 0,01% soluble en HCl N/10\nCadmio 0,20% soluble en HCl N/10\nCinc 0,20% soluble en HCl N/10\nMercurio 0,005% soluble en HCl N/10\nPlomo 0,01% soluble en HNO3 1N\nSelenio 0,01% soluble en HCl N/10\nEl contenido de aminas aromáticas no debe ser superior al 0,05% p/p"".\nArtículo 212\nEstá prohibido emplear, en la elaboración de materias plásticas y objetos de materias\nplásticas destinados a estar en contacto con alimentos, materias plásticas de segundo uso.\nArtículo 212 bis - (Resolución Conjunta N° 20/03 y N° 248/03)', 'Aluminio = 1 mg/kg de alimento o simulante alimentario.\nBario = 1 mg/kg de alimento o simulante alimentario.\nCobalto = 0,05 mg/kg de alimento o simulante alimentario.\nCobre = 5 mg/kg de alimento o simulante alimentario.\nHierro = 48 mg/kg de alimento o simulante alimentario.\nLitio = 0,6 mg/kg alimento o simulante alimentario.\nManganeso = 0,6 mg/kg de alimento o simulante alimentario.\nNíquel = 0,02 mg/kg de alimento o simulante alimentario.\nZinc= 5 mg/kg de alimento o simulante alimentario.\nPara los revestimientos poliméricos la evaluación del LME (T) de aluminio, bario, cobalto,\ncobre, hierro, litio, manganeso, níquel y zinc podrá ser realizada sobre el sustrato inerte;', 'términos fueron elaborados por la Coordinación Políticas Socioambientales de la entonces\nSecretaría de Gobierno de Salud del entonces Ministerio de Salud y Desarrollo Social y la ex\nSecretaría de Infraestructura y Política Hídrica del entonces Ministerio del Interior, Obras\nPúblicas y Vivienda. La Comisión Nacional de Alimentos deberá recomendar el límite máximo\nadmitido para dichas regiones del país en base a los estudios antes referidos.\nEn aquellas regiones del país con suelos de alto contenido de manganeso, la autoridad sanitaria\ncompetente podrá permitir valores mayores a 0.1 mg/l con un límite máximo de 0,4 mg/l\ncuando la composición normal del agua de la zona y la imposibilidad de aplicar tecnologías de\ncorrección lo hicieran necesario.', 'El Cóctel de Frutas deberá cumplir (conjunto de frutas y líquido) con los siguientes límites en el\ncontenido de metales:\nCobre, Máx.: 10 mg/kg Arsénico, Máx.: 0,1 mg/kg Plomo, Máx.: 2,0 mg/kg Estaño, Máx.:\n100,0 mg/kg.\nLa denominación de venta de este producto será “Cóctel de .... frutas, grado .... en ...”,\nllenando el primer espacio en blanco con el número de frutas (cuatro o cinco, en letras), el\nsegundo espacio en blanco con el grado de selección (elegido o común) y el tercer espacio en\nblanco con la denominación del líquido de cobertura. Para la expresión “Cóctel de .... Frutas,\ngrado ....” se utilizarán letras de igual tamaño, realce y visibilidad; para la frase “en ....” que', 'leucobase: máx 5%\nAminas aromáticas primarias no sulfonadas: máx 0,01% calculadas como anilinas\nArsénico: máx 3 mg/kg\nPlomo: máx 10 mg/kg\nMetales pesados: máx 40 mg/kg\nFAO Food and Nutrition Paper 31/1 (1984) y sus modificaciones"".\nArtículo 1325bis - Res 1541, 12.09.90)\nCon excepción de los criterios específicos de pureza contemplados para cada colorante, los\ncolorantes de uso alimentario (Artículos 1324 y 1325) deberán responder a los siguientes\ncriterios de pureza, referidos al contenido de materia colorante:\n1°) Impurezas inorgánicas:\nArsénico: máx 5 mg/kg\nAntimonio, Cobre, Cromo Sulfato de Bario, Zinc: máx 100 mg/kg (considerados aisladamente),\no máx 200 mg/kg (considerados en forma conjunta)\nPlomo: máx 20 mg/kg', 'Máximos - Miligramos por kilogramo\nAntimonio 2\nArsénico:\nen líquidos 0,1\nen sólidos 1\nBoro 80\nCobre 10\nEstaño 250\nFlúor 1,5\nPlata 1\nPlomo 2\nZinc 100\nRESOLUCIÓN GMC Nº 12/11\nIncorporada por Resolución Conjunta SPReI N° 116/2012 y SAGyP N° 356/2012\nREGLAMENTO TÉCNICO MERCOSUR SOBRE LÍMITES MÁXIMOS DE\nCONTAMINANTES INORGÁNICOS EN ALIMENTOS\n(DEROGACIÓN DE LAS RES. GMC Nº 102/94 y Nº 35/96)\nVISTO: El Tratado de Asunción, el Protocolo de Ouro Preto y las Resoluciones Nº 102/94,\n103/94, 35/96, 45/96, 38/98 y 56/02 del Grupo Mercado Común.\nCONSIDERANDO:\nQue es necesario actualizar los Límites Máximos de Contaminantes Inorgánicos en\nAlimentos;\nQue a los efectos de proteger la salud pública resulta esencial mantener el contenido de los', 'sus emulsiones acuosas como agente antiespumante en los procesos de elaboración de\nalimento, siempre que el producto terminado no contenga más de 10 mg/kg de\ndimetilpolisiloxano residual.\nArtículo 1398\nLos aditivos alimentarios que integran la lista positiva del Código Alimentario Argentino\nno contendrán más de 3 mg/kg de arsénico, como As; de 10 mg/kg de plomo, como\nPb; y de 40 mg/kg de metales pesados como Pb, salvo indicación particular diferente.\nEn general, se recomienda que no contenga más de 50 mg/kg de hierro y cobre\nglobalmente.\nResponderán a las exigencias que a continuación se detallan:\n1. ACEITES VEGETALES BROMADOS (Derogado por Res. Conj RESFC-2018-4-APN-\nSRYGS#MSYDS Nº4/2018)\n1.1 ACETALDEHIDO o ETANAL. (Res 1228, 28.5.75)', 'Los límites de migración específica así como la metodología analítica están establecidos en las\nResoluciones MERCOSUR correspondientes.\n6- Los envases y equipamientos plásticos no ocasionarán modificaciones inaceptables de la\ncomposición de los alimentos o de los caracteres sensoriales de los mismos.\n7- Para colorear envases y equipamientos plásticos destinados a entrar en contacto con alimentos\nse podrán utilizar todos los tipos de colorantes y pigmentos que cumplan los siguientes requisitos:\na. No deberán migrar hacia los alimentos;\nb. No contendrán metales en cantidades superiores a los siguientes porcentajes:\nArsénico (soluble en NaOH 1N) 0.005% m/m\nBario (soluble en HCl 0.1N) 0.01% m/m\nCadmio (soluble en HCl 0.1N) 0.01% m/m', '2.3 - Requisitos sobre metales y metaloides en colorantes.\nA partir de la entrada en vigencia del presente Reglamento Técnico, los colorantes no\ncontendrán metales y metaloides en cantidades superiores a los siguientes porcentajes:\nAntimonio (Sb) (soluble en HCl 0,1N) 0,05 % m/m\nArsénico (As) (soluble en HCl 0,1N) 0,005 % m/m\nBario (Ba) (soluble en HCl 0,1N) 0,01 % m/m\nCadmio (Cd) (soluble en HCl 0,1N) 0,01 % m/m\nCinc (Zn) (soluble en HCl 0,1N) 0,20 % m/m\nCromo (Cr) (soluble en HCl 0,1N) 0,10 % m/m\nMercurio (Hg) (soluble en HCl 0,1N) 0,005 % m/m\nPlomo (Pb) (soluble en HCl 0,1N) 0,01 % m/m\nSelenio (Se) (soluble en HCl 0,1N) 0,01 % m/m\nMetodología analítica:\na) Métodos para extracción de los metales y metaloides', 'Categorías\tLímite máximo\n(mg/kg)\nAceites y grasas comestibles de origen vegetal y/o animal\n(incluye margarina)\t0,10\nAzúcares\t0,10\nMiel\t0,30\nCaramelos duros y blandos y similares incluidos goma de mascar\t0,10\nPasta de cacao\t0,50\nChocolates y productos de cacao con menos de 40 % de cacao\t0,20\nChocolates y productos a base de cacao con más de 40 % de cacao\t0,40\nBebidas analcohólicas (excluidos los jugos)\t0,05\nZumos (Jugos) y néctares de frutas\t0,05\nBebidas alcohólicas fermentadas y fermento-destiladas, excepto vino\t0,20\nVino\t0,15 mg/L\nCereales y productos de y a base de cereales, excluidos trigo, arroz y\nsus productos derivados y aceites\t0,20\nTrigo y sus derivados excepto aceite\t0,20\nArroz y sus derivados excepto aceite\t0,20\nPoroto (grano) de soja\t0,20\nHortalizas del género Brassica (excluidas las de hojas sueltas)\t0,30\nHortalizas de hoja (incluidas las Brassicas de hoja suelta) y hierbas\naromáticas frescas\t0,30\nHortalizas de bulbo y hojas envainadoras\t0,10\nHortalizas de fruto de la familia Curcubitaceae\t0,10\nHortalizas de fruto, distintas de las de la familia Curcubitaceae\t0,10\nSetas (hongos) excepto las del género Agaricus, Pleurotus y Lentinula\no Lentinus\t0,10\nHortalizas leguminosa\t0,10\nLegumbres (semillas secas de las leguminosas) excepto soja\t0,20\nSetas (hongos) del género Agaricus, Pleurotus y Lentinula o Lentinus\t0,30\nRaíces y tubérculos\t0,10\nTallos jóvenes y pecíolos\t0,20\nFrutas secas\t0,80', 'Categorías\tLímite máximo\n(mg/kg)\nMiel\t0,10\nPasta de cacao\t0,30\nChocolates y productos de cacao con menos de 40 % de cacao\t0,20\nChocolates y productos a base de cacao con más de 40 % de cacao\t0,30\nBebidas analcohólicas (excluidos los jugos)\t0,02\nZumos (Jugos) y néctares de frutas\t0,05\nBebidas alcohólicas fermentadas y fermento-destiladas, excepto vino\t0,02\nVino\t0,01 mg/L\nCereales y productos de y a base de cereales, excluidos trigo, arroz y\nsus productos derivados y aceites\t0,10\nTrigo y sus derivados excepto aceite\t0,20\nArroz y sus derivados excepto aceite\t0,40\nPoroto (grano) de soja\t0,20\nHortalizas del género Brassica (excluidas las de hojas sueltas)\t0,05\nHortalizas de hoja (incluidas las Brassicas de hoja suelta) y hierbas\naromáticas frescas\t0,20\nHortalizas de bulbo y hojas envainadoras\t0,05\nHortalizas de fruto de la familia Curcubitaceae\t0,05\nHortalizas de fruto, distintas de las de la familia Curcubitaceae\t0,05\nSetas (hongos) excepto las del género Agaricus, Pleurotus y Lentinula\no Lentinus\t0,05\nHortalizas leguminosas\t0,10\nLegumbres (semillas secas de las leguminosas) excepto soja\t0,10\nSetas (hongos) del género Agaricus, Pleurotus y Lentinula o Lentinus\t0,20\nRaíces y tubérculos\t0,10\nTallos jóvenes y pecíolos\t0,10\nFrutas frescas, excluidas las bayas y frutas pequeñas\t0,05\nFrutas frescas de bayas y frutas pequeñas\t0,05\nTé, yerba mate, y otros vegetales para infusión\t0,40\nCafé torrado en granos y polvo\t0,10']","Los límites de metales aceptados en los alimentos varían según el tipo de alimento y el metal en cuestión. Según la información proporcionada, para el Cadmio (Cd) el límite es de < 1000 µg / kilo de carne de moluscos, para el Plomo (Pb) es < 1000 µg / kilo de carne de moluscos, y para el Mercurio (Hg) es < 500 µg / kilo de carne de moluscos. Además, se establece que los envases metálicos no deben ceder ciertos metales como plomo, cinc, antimonio, entre otros, en cantidades superiores a las establecidas en el reglamento. También se mencionan límites de migración específica (LME) para elementos como Antimonio, Arsénico, Bario, Cadmio, Cinc, Cobre, Cromo, Estaño, entre otros, en mg/kg. Es importante tener en cuenta que estos límites pueden variar dependiendo del tipo de alimento y del metal en cuestión.","Artículo 156 - (Res. 1546, 17.9.85)
""En los alimentos en general (con las excepciones particularmente previstas en el presente
Código) se tolera la presencia de los siguientes elementos metálicos y no metálicos dentro
de los límites que se establecen a continuación:
Máximos - Miligramos por kilogramo
Antimonio 2
Arsénico:
en líquidos 0,1
en sólidos 1
Boro 80
Cobre 10
Estaño 250
Flúor 1,5
Plata 1
Plomo 2
Zinc 100",0.9999999999937501,0.7272727272727273,0.9693308441835309,1.0,Basic
¿Cuáles son los límites de metales aceptados en los alimentos?,"['Los límites de metales aceptados en los alimentos son los siguientes:\n- Cadmio (Cd): Menos de 1000 µg por kilo de carne de moluscos.\n- Plomo (Pb): Menos de 1000 µg por kilo de carne de moluscos.\n- Mercurio (Hg): Menos de 500 µg por kilo de carne de moluscos.', 'Los límites de metales aceptados en los alimentos son los siguientes: los envases metálicos no deben ceder plomo, cinc, antimonio, cobre, cromo, hierro, estaño en cantidades superiores a las establecidas en el Artículo 156, ni otros contaminantes constituidos por metales o metaloides que puedan considerarse nocivos. Además, se menciona que las pruebas de cesión de metales pueden realizarse de acuerdo a un esquema específico que incluye la caracterización de productos alimenticios básicos y soluciones para ensayar la transferencia de metales.', 'Los límites de migración específica (LME) de los elementos en los alimentos son los siguientes:\n- Antimonio (Sb): 0,04 mg/kg\n- Arsénico (As): 0,01 mg/kg\n- Bario (Ba): 1 mg/kg\n- Boro (B): 0,5 mg/kg\n- Cadmio (Cd): 0,005 mg/kg\n- Cinc (Zn): 25 mg/kg\n- Cobre (Cu): 5 mg/kg\n- Cromo (Cr): 0,05 mg/kg\n- Estaño (Sn): 1,2 mg/kg\n- Flúor (F): 0,5 mg/kg\n- Mercurio (Hg): 0,005 mg/kg\n- Plata (Ag): 0,05 mg/kg\n- Plomo (Pb): 0,01 mg/kg\n\nLa determinación del contenido de metales en los alimentos se realiza utilizando técnicas espectrométricas para verificar el cumplimiento de los límites establecidos.', 'El límite de metales aceptados en los alimentos es que los materiales metálicos no deben contener más de 1% (m/m) de impurezas constituidas por plomo, arsénico, cadmio, mercurio, antimonio y cobre considerados en conjunto. Además, el límite individual de arsénico, mercurio y plomo no debe ser mayor de 0,01% (m/m).', 'Los límites de metales aceptados en los alimentos son los siguientes:\n- Arsénico: 0,005% soluble en NaOH lN\n- Bario: 0,01% soluble en HCl N/10\n- Cadmio: 0,20% soluble en HCl N/10\n- Cinc: 0,20% soluble en HCl N/10\n- Mercurio: 0,005% soluble en HCl N/10\n- Plomo: 0,01% soluble en HNO3 1N\n- Selenio: 0,01% soluble en HCl N/10\n\nAdemás, se menciona que el contenido de aminas aromáticas no debe ser superior al 0,05% p/p.', 'Aluminio = 1 mg/kg de alimento\nBario = 1 mg/kg de alimento\nCobalto = 0,05 mg/kg de alimento\nCobre = 5 mg/kg de alimento\nHierro = 48 mg/kg de alimento\nLitio = 0,6 mg/kg de alimento\nManganeso = 0,6 mg/kg de alimento\nNíquel = 0,02 mg/kg de alimento\nZinc = 5 mg/kg de alimento\n\nEn el texto se detallan los límites de metales aceptados en los alimentos, especificando la cantidad permitida de cada metal por kilogramo de alimento o simulante alimentario.', 'Los límites de metales aceptados en el Cóctel de Frutas son los siguientes:\n- Cobre, Máx.: 10 mg/kg\n- Arsénico, Máx.: 0,1 mg/kg\n- Plomo, Máx.: 2,0 mg/kg\n- Estaño, Máx.: 100,0 mg/kg.', 'Arsénico: máx 3 mg/kg\nPlomo: máx 10 mg/kg\nMetales pesados: máx 40 mg/kg\n\nEstos son los límites de metales aceptados en los alimentos según el fragmento proporcionado.', 'Plomo: 2 miligramos por kilogramo.', 'Los límites de metales aceptados en los alimentos según el Código Alimentario Argentino son los siguientes:\n- Arsénico: máximo 3 mg/kg\n- Plomo: máximo 10 mg/kg\n- Metales pesados (como plomo): máximo 40 mg/kg, a menos que se indique lo contrario\n- Hierro y cobre globalmente: se recomienda que no contengan más de 50 mg/kg.', 'Los límites de metales aceptados en los alimentos son los siguientes:\n- Arsénico (soluble en NaOH 1N): máximo 0.005% m/m\n- Bario (soluble en HCl 0.1N): máximo 0.01% m/m\n- Cadmio (soluble en HCl 0.1N): máximo 0.01% m/m', 'Los límites de metales aceptados en los alimentos son los siguientes:\n- Antimonio (Sb): 0,05 % m/m\n- Arsénico (As): 0,005 % m/m\n- Bario (Ba): 0,01 % m/m\n- Cadmio (Cd): 0,01 % m/m\n- Cinc (Zn): 0,20 % m/m\n- Cromo (Cr): 0,10 % m/m\n- Mercurio (Hg): 0,005 % m/m\n- Plomo (Pb): 0,01 % m/m\n- Selenio (Se): 0,01 % m/m\n\nPor lo tanto, los límites de metales aceptados en los alimentos están regulados por el Reglamento Técnico mencionado en el texto.', 'Límites de metales en alimentos:\n- Aceites y grasas comestibles de origen vegetal y/o animal: 0,10 mg/kg\n- Azúcares: 0,10 mg/kg\n- Miel: 0,30 mg/kg\n- Caramelos duros y blandos y similares incluidos goma de mascar: 0,10 mg/kg\n- Pasta de cacao: 0,50 mg/kg\n- Chocolates y productos de cacao con menos de 40 % de cacao: 0,20 mg/kg\n- Chocolates y productos a base de cacao con más de 40 % de cacao: 0,40 mg/kg\n- Bebidas analcohólicas (excluidos los jugos): 0,05 mg/kg\n- Zumos (Jugos) y néctares de frutas: 0,05 mg/kg\n- Bebidas alcohólicas fermentadas y fermento-destiladas, excepto vino: 0,20 mg/kg\n- Vino: 0,15 mg/L\n- Cereales y productos de y a base de cereales, excluidos trigo, arroz y sus productos derivados y aceites: 0,20 mg/kg\n- Trigo y sus derivados excepto aceite: 0,20 mg/kg\n- Arroz y sus derivados excepto aceite: 0,20 mg/kg\n- Poroto (grano) de soja: 0,20 mg/kg\n- Hortalizas del género Brassica (excluidas las de hojas sueltas): 0,30 mg/kg\n- Hortalizas de hoja (incluidas las Brassicas de hoja suelta) y hierbas aromáticas frescas: 0,30 mg/kg\n- Hortalizas de bulbo y hojas envainadoras: 0,10 mg/kg\n- Hortalizas de fruto de la familia Curcubitaceae: 0,10 mg/kg\n- Hortalizas de fruto, distintas de las de la familia Curcubitaceae: 0,10 mg/kg\n- Setas (hongos) excepto las del género Agaricus, Pleurotus y Lentinula o Lentinus: 0,10 mg/kg\n- Hortalizas leguminosa: 0,10 mg/kg\n- Legumbres (semillas secas de las leguminosas) excepto soja: 0,20 mg/kg\n- Setas (hongos) del género Agaricus, Pleurotus y Lentinula o Lentinus: 0,30 mg/kg\n- Raíces y tubérculos: 0,10 mg/kg\n- Tallos jóvenes y pecíolos: 0,20 mg/kg\n- Frutas secas: 0,80 mg/kg', 'El contenido de ácidos grasos trans de producción industrial en los alimentos no debe ser mayor al 2% del total de grasas. Sin embargo, en cuanto a metales y elementos no metálicos en los alimentos, se establecen límites específicos que no se mencionan en el fragmento proporcionado. <irrelevant>', 'El contenido de plomo no podrá superar 0,01 mg/kg del producto listo para el consumo.\nEl contenido de arsénico no podrá superar los 0,05 mg/kg del producto listo para el consumo.\nEl contenido de aluminio no podrá superar 1 mg/kg del producto listo para el consumo.', 'Hierro total como Fe tiene un límite de composición máximo de 70 mg/kg en alimentos. Hierro soluble en agua como Fe tiene un límite de migración específica de máximo 15 mg/kg. Plomo como Pb tiene un límite de composición máximo de 20 mg/kg en alimentos. No deben ser detectados ácido bórico y otros antisépticos en los alimentos. En cuanto al formaldehído, el límite máximo permitido es de 1,0 mg de formaldehído/dm2 en el producto terminado.']","Los límites de metales aceptados en los alimentos varían según el metal y la normativa específica. A continuación se detallan algunos de los límites mencionados en el contexto proporcionado:

- Cadmio (Cd): Menos de 1000 µg por kilo de carne de moluscos.
- Plomo (Pb): Menos de 1000 µg por kilo de carne de moluscos.
- Mercurio (Hg): Menos de 500 µg por kilo de carne de moluscos.
- Antimonio (Sb): 0,04 mg/kg
- Arsénico (As): 0,01 mg/kg
- Bario (Ba): 1 mg/kg
- Boro (B): 0,5 mg/kg
- Cinc (Zn): 25 mg/kg
- Cobre (Cu): 5 mg/kg
- Cromo (Cr): 0,05 mg/kg
- Estaño (Sn): 1,2 mg/kg
- Flúor (F): 0,5 mg/kg
- Mercurio (Hg): 0,005 mg/kg
- Plata (Ag): 0,05 mg/kg
- Plomo (Pb): 0,01 mg/kg

Es importante tener en cuenta que estos límites pueden variar dependiendo de la normativa específica y el tipo de alimento.","Artículo 156 - (Res. 1546, 17.9.85)
""En los alimentos en general (con las excepciones particularmente previstas en el presente
Código) se tolera la presencia de los siguientes elementos metálicos y no metálicos dentro
de los límites que se establecen a continuación:
Máximos - Miligramos por kilogramo
Antimonio 2
Arsénico:
en líquidos 0,1
en sólidos 1
Boro 80
Cobre 10
Estaño 250
Flúor 1,5
Plata 1
Plomo 2
Zinc 100",0.8670853718863942,1.0,0.9122967329795473,0.0,Advanced
¿Qué antioxidantes o sinergistas pueden agregarse a los aceites y grasas vegetales comestibles?,"['alimentaria y servicios gastronómicos deberán reunir las características y responder a las\nexigencias de los aceites y grasas incluidos en el presente Código.\nEn el caso de los aceites deberán estar adicionados de antioxidantes y/o sinergistas autorizados\nsegún el Artículo 523 bis, Inc. 2, 3, 4, 6, 7, 8 y 9.\nSe permite el agregado de metilsilicona como antiespumante en cantidad no superior a 10\nmg/kg (10 ppm).\nDe acuerdo con las condiciones en que se realice el proceso de fritura, la autoridad sanitaria\ncompetente podrá desestimar el uso de aceites cuyo contenido en ácido linolénico sea superior\nal 2% de los ácidos grasos.\nArtículo 552bis - (Resolución Conjunta SCS y SAByDR N° 17/2021)', 'refieran al aceite proveniente de una sola especie vegetal"".\nArtículo 523 - (Res 2012, 19.10.84)\n""Queda prohibido adicionar a los aceites alimenticios substancias extrañas destinadas a dar\nsabor, aroma, color o a modificar sus caracteres fisicoquímicos"".\nArtículo 523bis - (Res 2012, 19.10.84)\n""Los aceites y grasas vegetales comestibles podrán ser adicionados, con la exclusión de los\naceites de oliva de presión no refinados, de los siguientes antioxidantes y sinergistas:\n1. Galato de propilo, galato de octilo y galato de dodecilo (o sus mezclas), Máx: 100 mg/kg\n(100 ppm), aislados o mezclados.\n2. Hidroxianisol butilado (BHA), Máx: 200 mg/kg (200 ppm).\n3. Hidroxitolueno butilado (BHT), Máx: 200 mg/kg (200 ppm)', 'Queda permitida la adición a los aceites esenciales de los siguientes antioxidantes: galato de\npropilo, octilo o dodecilo; butilhidroxianisol (BHA); butilhidroxitolueno (BHT), en una cantidad\nno superior a 1,0 g/kg, ya sea aisladamente o en mezclas que no superen esta cantidad.\nArtículo 1302\nLos valores de las distintas características fisicoquímicas mencionadas para los aceites\nesenciales serán determinadas de acuerdo a los métodos que figuran en las normas IRAM\ncorrespondientes.\nArtículo 1303\nLos aceites esenciales o esencias naturales podrán expenderse aisladamente o en mezclas y en\nlas que cada una deberá responder a sus características.\nCuando se trate de una esencia natural deberá rotularse exclusivamente con su denominación', 'La cantidad de antioxidantes, emulsionantes y sinergistas en relación al contenido de substancias\ngrasas, no deberá ser superior a la permitida en el presente Código.\nLa cantidad permitida de glutamato de sodio y/o potasio no deberá ser superior a 8 g por dm3,\nexpresado como ácido glutámico referido al producto constituido listo para su consumo y la de\nlos ácidos inosínico y guanílico, sus mezclas y/o sales de sodio y/o potasio, deberá ser superior\na 0,50 g por dm3.\nEstos productos deberán expenderse en envases bromatológicamente aptos que preserven sus\ncualidades físicas, organolépticas y microbiológicas.\nLas sopas, sopas concentradas y sopas deshidratadas preparadas de acuerdo a las instrucciones', 'usen solos (si el aceite posee suficientes antioxidantes naturales) o en mezclas sinérgicas con\nlos antioxidantes citados en los Inc 1 a 8"".\nArtículo 524 - (Res 2012, 19.10.84)\n""El aceite comestible destinado a ser fraccionado deberá ser almacenado en recipientes\nadecuados, mantenidos en todo momento en condiciones de higiene.\nQueda prohibido envasar aceites comestibles en los comercios detallistas y demás lugares de\nventa al público, como también el expendio ambulante de los mismos.\nLos establecimientos que fraccionan y envasan aceites, deben cumplir con las disposiciones\ngenerales del presente y, además, disponer de locales destinados exclusivamente a este fin,\naprobados por la autoridad competente"".', 'entiende la grasa alimenticia concreta, de punto de fusión como mínimo de 20°C, que contiene\npor lo menos el 50% de ácidos linoleico y araquidónico referidos al total de ácidos grasos.\nDeberán contener como mínimo 1 mg de vitamina E por gramo de ácidos grasos esenciales.\nPodrán ser adicionados de los aditivos mencionados en el Artículo 1376 a excepción de los\ncaseinatos de sodio, potasio y calcio. Este producto se rotulará de acuerdo con las exigencias\ndel Artículo 1345 con la indicación Tenor Garantido de Acidos Grasos Esenciales. Deberá\nconsignar el contenido de ácidos grasos esenciales expresado en gramos por 100 gramos del\nproducto"".\nArtículo 1378bis - (Res 305, 26.03.93)', 'Caseinatos de Sodio, Potasio y Calcio y/u otras proteínas lácteas.\nSe admite el uso de olestra (octa, hepta, hexa ésteres de ácidos grasos de cadena larga con\nsacarosa) en productos de copetín (snacks) salados o picantes pero no dulces.\nEn estos alimentos se podrá utilizar olestra en reemplazo de grasas y aceites para freír u\nhornear, como acondicionador de masa, en sprays, como ingrediente de rellenos o en\naromatizantes-saborizantes. En el caso de utilizar olestra deberán ser incorporadas las\nsiguientes Vitaminas: 1,9 mg de Alfatocoferol, 51 eq Retinol (como Acetato o Palmitato de\nRetinol); 12 UI Vitamina D y 8 microgramos de Vitamina K, por gramo de olestra.\nEl olestra deberá cumplir con las siguientes exigencias:', 'European Food Safety Authority (EFSA); Authority of Public Health Agency of Canada; United\nStates Pharmacopeia (USP), British Pharmacopeia (BP), Farmacopea Japonesa.\nPara los nutrientes arriba citados podrán emplearse los aditivos alimentarios contemplados en\nel presente artículo y los siguientes aditivos cuando por razones tecnológicas se requieran:\nN° de Nivel máximo en el alimento\nAditivo\nINS listo para el consumo (mg/kg)\n414 Goma arábiga (goma de acacia) 10\n551 Dióxido de silicio amorfo 10\n421 Manitol (B12 frotamiento en seco 0.1 % solo) 10\nAlmidón modificado (Octenilsuccionato sódico\n1450 100\nde almidón)\nL-ascorbato de sodio (en las capas que\n301 recubren preparados nutricionales que 75\ncontienen ácidos grasos poliinsaturados', '3.7.5. Ácidos grasos obtenidos de aceites y grasas, animales y vegetales, y sus sales de aluminio,\namonio, calcio, magnesio, potasio, sodio y zinc.\n3.7.6. Triglicéridos y aceites marinos, así como los ácidos grasos y alcoholes derivados de estos,\nque reaccionan con uno o más de los siguientes compuestos, con o sin deshidratación, para formar\nlas sustancias pertenecientes a las clases químicas indicadas entre paréntesis:\na) óxido de etileno (éster y éter);\nb) óxido de propileno (éster);\nc) polioxietileno, peso molecular 200, 300, 400, 600, 700, 1.000, 1.540, 1.580, 1.760, 4.600\n(éster);\nd) polioxipropileno, peso molecular 200 a 2000 (éster);\ne) Propilenglicol (éster);\nf) Etilenglicol (éster);\ng) Butanol (éster);\nh) Isobutanol (éster);']","Los antioxidantes o sinergistas que pueden agregarse a los aceites y grasas vegetales comestibles, según lo establecido en el contexto proporcionado, son los siguientes:

1. Galato de propilo, galato de octilo y galato de dodecilo (o sus mezclas), con un máximo de 100 mg/kg (100 ppm).
2. Hidroxianisol butilado (BHA), con un máximo de 200 mg/kg (200 ppm).
3. Hidroxitolueno butilado (BHT), con un máximo de 200 mg/kg (200 ppm).

Estos son los antioxidantes y sinergistas autorizados para ser adicionados a los aceites y grasas vegetales comestibles, excluyendo los aceites de oliva de presión no refinados.","Artículo 523bis - (Res 2012, 19.10.84)
""Los aceites y grasas vegetales comestibles podrán ser adicionados, con la exclusión de los
aceites de oliva de presión no refinados, de los siguientes antioxidantes y sinergistas:
1. Galato de propilo, galato de octilo y galato de dodecilo (o sus mezclas), Máx: 100 mg/kg
(100 ppm), aislados o mezclados.
2. Hidroxianisol butilado (BHA), Máx: 200 mg/kg (200 ppm).
3. Hidroxitolueno butilado (BHT), Máx: 200 mg/kg (200 ppm)
4. Terbutilhidroquinona (TBHQ), Máx: 200 mg/kg (200 ppm).
5. Mezcla de los galatos citados, BHA y/o BHT, Máx: 200 mg/kg (200 ppm) siempre que no
incorporen más de 100 mg/kg (100 ppm) de galatos.
6. Mezclas de TBHQ con BHA y BHT, Máx: 200 mg/kg (200 ppm).
7. Tocoferoles naturales o sintéticos (en concentración que no exceda la necesaria para el
efecto deseado).
8. Palmitato y estearato de ascorbilo, Máx: 200 mg/kg (200 ppm), aislados o mezclados.
9. Acido cítrico, ácido fosfórico, citrato de monoisopropilo, ésteres de monoglicéridos con ácido
cítrico, Máx: 100 mg/kg (100 ppm), aislados o mezclados.
El máximo señalado para los compuestos comprendidos en el Inc 9 será el mismo cuando se
usen solos (si el aceite posee suficientes antioxidantes naturales) o en mezclas sinérgicas con
los antioxidantes citados en los Inc 1 a 8"".",0.9999999999888889,1.0,0.8968559018943324,1.0,Basic
¿Qué antioxidantes o sinergistas pueden agregarse a los aceites y grasas vegetales comestibles?,"['Antioxidantes y sinergistas autorizados que pueden agregarse a los aceites y grasas vegetales comestibles según el texto son los mencionados en el Artículo 523 bis, Inc. 2, 3, 4, 6, 7, 8 y 9. Además, se permite el agregado de metilsilicona como antiespumante en cantidad no superior a 10 mg/kg.', 'Los antioxidantes y sinergistas que pueden agregarse a los aceites y grasas vegetales comestibles, excluyendo los aceites de oliva de presión no refinados, son los siguientes:\n1. Galato de propilo, galato de octilo y galato de dodecilo (o sus mezclas) hasta un máximo de 100 mg/kg (100 ppm).\n2. Hidroxianisol butilado (BHA) hasta un máximo de 200 mg/kg (200 ppm).\n3. Hidroxitolueno butilado (BHT) hasta un máximo de 200 mg/kg (200 ppm).', 'Antioxidantes que pueden agregarse a los aceites y grasas vegetales comestibles según el texto: galato de propilo, octilo o dodecilo; butilhidroxianisol (BHA); butilhidroxitolueno (BHT), en una cantidad no superior a 1,0 g/kg, ya sea aisladamente o en mezclas que no superen esta cantidad.', 'Antioxidantes o sinergistas que pueden agregarse a los aceites y grasas vegetales comestibles son aquellos mencionados en los Incisos 1 a 8 del artículo 524. No se especifican cuáles son estos antioxidantes en el fragmento proporcionado.', 'Se permite el agregado de antioxidantes y sinergistas autorizados para aceites en el Artículo 523 en las mismas proporciones para los aceites y grasas vegetales comestibles.', ""Antioxidantes o sinergistas que pueden agregarse a los aceites y grasas vegetales comestibles:\n- Carotenos: Extractos Naturales\n- Rocú/ Annatto/ Urucu/ Bixina/ Norbixina\n- Paprika/Capsantina/Capsorrubina\n- Beta-Apo-8'Carotenal\n- Ester Metílico o Etílico del Acido Beta-Apo-8'-Carotenoico\n- Antocianinas (de frutas y hortalizas)"", 'Ácido ascórbico y sus sales de sodio, potasio, calcio, magnesio y amonio pueden agregarse como antioxidantes a los aceites y grasas vegetales comestibles.', 'Los antioxidantes que pueden agregarse a la grasa anhidra de leche o butter oil no destinado a la elaboración de productos lácteos son el Butil Hidroxianisol (BHA), Butilhidroxitolueno (BHT), Terbutilhidroxiquinona (TBHQ) y los galatos (propil, octil y dodecilgalatos), ya sea solos o en mezclas en proporciones específicas. Los galatos no deben exceder los 100 mg/kg solos o combinados, el BHT no debe exceder los 75 mg/kg y la TBHQ no debe exceder los 120 mg/kg. El total de aditivos no debe superar los 200 mg/kg, siendo este el límite máximo para el BHA.', 'Aceites y/o grasas comestibles, hidrogenados o no, son productos a los que se les pueden agregar antioxidantes o sinergistas.']","Los antioxidantes o sinergistas que pueden agregarse a los aceites y grasas vegetales comestibles, según el texto proporcionado, son los siguientes:

1. Galato de propilo, galato de octilo y galato de dodecilo (o sus mezclas) hasta un máximo de 100 mg/kg (100 ppm).
2. Hidroxianisol butilado (BHA) hasta un máximo de 200 mg/kg (200 ppm).
3. Hidroxitolueno butilado (BHT) hasta un máximo de 200 mg/kg (200 ppm).
4. Carotenos: Extractos Naturales.
5. Rocú/ Annatto/ Urucu/ Bixina/ Norbixina.
6. Paprika/Capsantina/Capsorrubina.
7. Beta-Apo-8'Carotenal.
8. Ester Metílico o Etílico del Ácido Beta-Apo-8'-Carotenoico.
9. Antocianinas (de frutas y hortalizas).
10. Ácido ascórbico y sus sales de sodio, potasio, calcio, magnesio y amonio.

Es importante tener en cuenta las cantidades máximas permitidas para cada uno de estos antioxidantes o sinergistas al momento de agregarlos a los aceites y grasas vegetales comestibles.","Artículo 523bis - (Res 2012, 19.10.84)
""Los aceites y grasas vegetales comestibles podrán ser adicionados, con la exclusión de los
aceites de oliva de presión no refinados, de los siguientes antioxidantes y sinergistas:
1. Galato de propilo, galato de octilo y galato de dodecilo (o sus mezclas), Máx: 100 mg/kg
(100 ppm), aislados o mezclados.
2. Hidroxianisol butilado (BHA), Máx: 200 mg/kg (200 ppm).
3. Hidroxitolueno butilado (BHT), Máx: 200 mg/kg (200 ppm)
4. Terbutilhidroquinona (TBHQ), Máx: 200 mg/kg (200 ppm).
5. Mezcla de los galatos citados, BHA y/o BHT, Máx: 200 mg/kg (200 ppm) siempre que no
incorporen más de 100 mg/kg (100 ppm) de galatos.
6. Mezclas de TBHQ con BHA y BHT, Máx: 200 mg/kg (200 ppm).
7. Tocoferoles naturales o sintéticos (en concentración que no exceda la necesaria para el
efecto deseado).
8. Palmitato y estearato de ascorbilo, Máx: 200 mg/kg (200 ppm), aislados o mezclados.
9. Acido cítrico, ácido fosfórico, citrato de monoisopropilo, ésteres de monoglicéridos con ácido
cítrico, Máx: 100 mg/kg (100 ppm), aislados o mezclados.
El máximo señalado para los compuestos comprendidos en el Inc 9 será el mismo cuando se
usen solos (si el aceite posee suficientes antioxidantes naturales) o en mezclas sinérgicas con
los antioxidantes citados en los Inc 1 a 8"".",0.9999999999888889,1.0,0.8997146632528081,0.5,Advanced
